Cites,Authors,Title,Year,Source,Publisher,ArticleURL,CitesURL,GSRank,QueryDate,Type,DOI,ISSN,CitationURL,Volume,Issue,StartPage,EndPage,ECC,CitesPerYear,CitesPerAuthor,AuthorCount,Age,Abstract,FullTextURL,RelatedURL
0,"F.G. Augusto","Opposing δ13C and δ15N signatures in terrestrial and aquatic insects from Brazilian ecosystems by human disturbance",2025,"Science of the Total Environment","","https://api.elsevier.com/content/article/eid/1-s2.0-S004896972502385X","https://www.scopus.com/inward/citedby.uri?partnerID=HzOxMe3b&scp=105018960803&origin=inward",105,"2026-01-04 12:44:07","Article","10.1016/j.scitotenv.2025.180745","0048-9697","https://api.elsevier.com/content/abstract/scopus_id/105018960803",1003,,,,0,0.00,0,1,1,"","",""
0,"M. Moriondo","Patterns and surrogates of EPT taxa (Ephemeroptera, Plecoptera, Trichoptera) in glacier-fed streams: insights from Western Italian Alps",2025,"Aquatic Insects","","https://www.scopus.com/inward/record.uri?partnerID=HzOxMe3b&scp=105010415732&origin=inward","https://www.scopus.com/inward/citedby.uri?partnerID=HzOxMe3b&scp=105010415732&origin=inward",98,"2026-01-04 12:44:07","Article","10.1080/01650424.2025.2525220","0165-0424","https://api.elsevier.com/content/abstract/scopus_id/105010415732",,,,,0,0.00,0,1,1,"","",""
0,"C.R. Wang","Patterns of macroinvertebrate communities and their driving factors in streams of Guangdong Liannan Giant Salamander Provincial Nature Reserve",2025,"Zhongguo Huanjing Kexue China Environmental Science","","https://www.scopus.com/inward/record.uri?partnerID=HzOxMe3b&scp=105017717115&origin=inward","https://www.scopus.com/inward/citedby.uri?partnerID=HzOxMe3b&scp=105017717115&origin=inward",162,"2026-01-04 12:44:07","Article","","1000-6923","https://api.elsevier.com/content/abstract/scopus_id/105017717115",45,9,5152,5162,0,0.00,0,1,1,"","",""
3,"O.N. Vdovina","PATTERNS OF MACROINVERTEBRATE DISTRIBUTION IN WATERCOURSES OF THE KRASNOYARSK STOLBY NATIONAL PARK (EAST SIBERIA)",2025,"Nature Conservation Research","","https://www.scopus.com/inward/record.uri?partnerID=HzOxMe3b&scp=105000528104&origin=inward","https://www.scopus.com/inward/citedby.uri?partnerID=HzOxMe3b&scp=105000528104&origin=inward",12,"2026-01-04 12:44:07","Article","10.24189/ncr.2025.004","2500-008X","https://api.elsevier.com/content/abstract/scopus_id/105000528104",10,1,50,65,3,3.00,3,1,1,"","",""
0,"H. Ibrahimi","Potamophylax rilaensis sp. nov. (Trichoptera: Limnephilidae), a new species of the Potamophylax winneguthi Species Cluster from Bulgaria",2025,"Zootaxa","","https://www.scopus.com/inward/record.uri?partnerID=HzOxMe3b&scp=105006480660&origin=inward","https://www.scopus.com/inward/citedby.uri?partnerID=HzOxMe3b&scp=105006480660&origin=inward",95,"2026-01-04 12:44:07","Article","10.11646/zootaxa.5642.3.4","1175-5326","https://api.elsevier.com/content/abstract/scopus_id/105006480660",5642,3,260,270,0,0.00,0,1,1,"","",""
1,"C.A. Huitger","Potential Water-Quality and Hydrology Stressors on Freshwater Mussels With Development of Environmental DNA Assays for Selected Mussels and Macroinvertebrates in Big Darby Creek Basin, Ohio, 2020–22",2025,"Usgs Scientific Investigations Report","","https://www.scopus.com/inward/record.uri?partnerID=HzOxMe3b&scp=105003770283&origin=inward","https://www.scopus.com/inward/citedby.uri?partnerID=HzOxMe3b&scp=105003770283&origin=inward",51,"2026-01-04 12:44:07","Article","10.3133/sir20255005","2328-031X","https://api.elsevier.com/content/abstract/scopus_id/105003770283",2025,,,,1,1.00,1,1,1,"","",""
3,"D.C. Houghton","Predicting landscape disturbance using adult Trichoptera: one (caddis) metric to rule them all?",2025,"Zookeys","","https://www.scopus.com/inward/record.uri?partnerID=HzOxMe3b&scp=105024975365&origin=inward","https://www.scopus.com/inward/citedby.uri?partnerID=HzOxMe3b&scp=105024975365&origin=inward",10,"2026-01-04 12:44:07","Article","10.3897/zookeys.1263.141377","1313-2989","https://api.elsevier.com/content/abstract/scopus_id/105024975365",,1263,147,164,3,3.00,3,1,1,"","",""
0,"B. Ríos-Touma","Preface: Proceedings of the 18th International Symposium on Trichoptera",2025,"Zookeys","","https://www.scopus.com/inward/record.uri?partnerID=HzOxMe3b&scp=105024951991&origin=inward","https://www.scopus.com/inward/citedby.uri?partnerID=HzOxMe3b&scp=105024951991&origin=inward",180,"2026-01-04 12:44:07","Editorial","10.3897/zookeys.1263.177866","1313-2989","https://api.elsevier.com/content/abstract/scopus_id/105024951991",,1263,1,19,0,0.00,0,1,1,"","",""
1,"C. Evangelista","Prolonged low flows and non-native fish operate additively to alter insect emergence in mountain streams",2025,"Limnology and Oceanography","","https://www.scopus.com/inward/record.uri?partnerID=HzOxMe3b&scp=105011861534&origin=inward","https://www.scopus.com/inward/citedby.uri?partnerID=HzOxMe3b&scp=105011861534&origin=inward",78,"2026-01-04 12:44:07","Article","10.1002/lno.70112","0024-3590","https://api.elsevier.com/content/abstract/scopus_id/105011861534",70,,,,1,1.00,1,1,1,"","",""
0,"I. Carachilo","Quantifying and classifying microplastics and microparticles across aquatic heterotrophs from headwater streams in central Pennsylvania",2025,"Journal of Freshwater Ecology","","https://www.scopus.com/inward/record.uri?partnerID=HzOxMe3b&scp=105021919119&origin=inward","https://www.scopus.com/inward/citedby.uri?partnerID=HzOxMe3b&scp=105021919119&origin=inward",197,"2026-01-04 12:44:07","Article","10.1080/02705060.2025.2579096","0270-5060","https://api.elsevier.com/content/abstract/scopus_id/105021919119",40,1,,,0,0.00,0,1,1,"","",""
0,"U. Langheinrich","Recovery of Streams in the Harz National Park (Germany)—The Attenuation of Acidification",2025,"Ecologies","","https://www.scopus.com/inward/record.uri?partnerID=HzOxMe3b&scp=105001384924&origin=inward","https://www.scopus.com/inward/citedby.uri?partnerID=HzOxMe3b&scp=105001384924&origin=inward",157,"2026-01-04 12:44:07","Article","10.3390/ecologies6010013","2673-4133","https://api.elsevier.com/content/abstract/scopus_id/105001384924",6,1,,,0,0.00,0,1,1,"","",""
0,"T. Nozaki","Redescriptions of Homoplectra japonica (Banks 1906) and H. albomarginata (Ulmer 1907) (Trichoptera, Hydropsychidae), with descriptions of five new similar species from Japan",2025,"Zootaxa","","https://www.scopus.com/inward/record.uri?partnerID=HzOxMe3b&scp=85215825146&origin=inward","https://www.scopus.com/inward/citedby.uri?partnerID=HzOxMe3b&scp=85215825146&origin=inward",108,"2026-01-04 12:44:07","Article","10.11646/zootaxa.5566.2.4","1175-5326","https://api.elsevier.com/content/abstract/scopus_id/85215825146",5566,2,303,328,0,0.00,0,1,1,"","",""
1,"G.M. Gíslason","Relationship of Trichoptera species in Iceland with Europe and North America",2025,"Zookeys","","https://www.scopus.com/inward/record.uri?partnerID=HzOxMe3b&scp=105024941221&origin=inward","https://www.scopus.com/inward/citedby.uri?partnerID=HzOxMe3b&scp=105024941221&origin=inward",74,"2026-01-04 12:44:07","Article","10.3897/zookeys.1263.148150","1313-2989","https://api.elsevier.com/content/abstract/scopus_id/105024941221",,1263,89,104,1,1.00,1,1,1,"","",""
0,"J. Whitt","Removing invasive stream macrofauna shifts nontarget invertebrate mesofauna through facilitation",2025,"Ecosphere","","https://www.scopus.com/inward/record.uri?partnerID=HzOxMe3b&scp=105024561181&origin=inward","https://www.scopus.com/inward/citedby.uri?partnerID=HzOxMe3b&scp=105024561181&origin=inward",128,"2026-01-04 12:44:07","Article","10.1002/ecs2.70489","2150-8925","https://api.elsevier.com/content/abstract/scopus_id/105024561181",16,12,,,0,0.00,0,1,1,"","",""
0,"J. Tang","Response of macroinvertebrate drift to dam-induced flow fluctuations: A field experiment in the Yarlung Zangbo river",2025,"Journal of Environmental Management","","https://api.elsevier.com/content/article/eid/1-s2.0-S0301479725035868","https://www.scopus.com/inward/citedby.uri?partnerID=HzOxMe3b&scp=105018581915&origin=inward",93,"2026-01-04 12:44:07","Article","10.1016/j.jenvman.2025.127610","0301-4797","https://api.elsevier.com/content/abstract/scopus_id/105018581915",394,,,,0,0.00,0,1,1,"","",""
0,"E. Szarek-Gwiazda","Response of Trichoptera and Oligochaeta Communities to Modifications of Mountain River Channels with Low-Head Barriers",2025,"Water Switzerland","","https://www.scopus.com/inward/record.uri?partnerID=HzOxMe3b&scp=85217643270&origin=inward","https://www.scopus.com/inward/citedby.uri?partnerID=HzOxMe3b&scp=85217643270&origin=inward",122,"2026-01-04 12:44:07","Article","10.3390/w17030404","2073-4441","https://api.elsevier.com/content/abstract/scopus_id/85217643270",17,3,,,0,0.00,0,1,1,"","",""
0,"A. Wells","Revision of the Australian genus Stenopsychodes Ulmer (Stenopsychidae: Trichoptera)",2025,"Memoirs of Museum Victoria","","https://www.scopus.com/inward/record.uri?partnerID=HzOxMe3b&scp=105025217626&origin=inward","https://www.scopus.com/inward/citedby.uri?partnerID=HzOxMe3b&scp=105025217626&origin=inward",146,"2026-01-04 12:44:07","Article","10.24199/j.mmv.2025.84.03","1447-2546","https://api.elsevier.com/content/abstract/scopus_id/105025217626",84,,89,126,0,0.00,0,1,1,"","",""
1,"Y. Qu","River invertebrate biodiversity benefits from upstream urban woodland",2025,"Landscape and Urban Planning","","https://api.elsevier.com/content/article/eid/1-s2.0-S0169204624002500","https://www.scopus.com/inward/citedby.uri?partnerID=HzOxMe3b&scp=85208251757&origin=inward",56,"2026-01-04 12:44:07","Article","10.1016/j.landurbplan.2024.105251","0169-2046","https://api.elsevier.com/content/abstract/scopus_id/85208251757",254,,,,1,1.00,1,1,1,"","",""
1,"V. Ergović","Seasonal Dynamics and Factors Shaping Aquatic Insect Assemblages in Mountain Streams of the Pannonian Lowland Ecoregion",2025,"Insects","","https://www.scopus.com/inward/record.uri?partnerID=HzOxMe3b&scp=105003587875&origin=inward","https://www.scopus.com/inward/citedby.uri?partnerID=HzOxMe3b&scp=105003587875&origin=inward",59,"2026-01-04 12:44:07","Article","10.3390/insects16040344","2075-4450","https://api.elsevier.com/content/abstract/scopus_id/105003587875",16,4,,,1,1.00,1,1,1,"","",""
5,"J. Ge","Seasonal Variations in Macrobenthos Communities and Their Relationship with Environmental Factors in the Alpine Yuqu River",2025,"Biology","","https://www.scopus.com/inward/record.uri?partnerID=HzOxMe3b&scp=85218859809&origin=inward","https://www.scopus.com/inward/citedby.uri?partnerID=HzOxMe3b&scp=85218859809&origin=inward",5,"2026-01-04 12:44:07","Article","10.3390/biology14020120","2079-7737","https://api.elsevier.com/content/abstract/scopus_id/85218859809",14,2,,,5,5.00,5,1,1,"","",""
0,"L.S. Balistrieri","Sensitivity of Benthic Biota and Toxicity of Cadmium, Cobalt, Copper, Nickel, Lead, and Zinc Mixtures in Near-Surface Porewater in the Upper Columbia River Basin, Washington, United States, and British Columbia, Canada",2025,"Usgs Scientific Investigations Report","","https://www.scopus.com/inward/record.uri?partnerID=HzOxMe3b&scp=85218781980&origin=inward","https://www.scopus.com/inward/citedby.uri?partnerID=HzOxMe3b&scp=85218781980&origin=inward",115,"2026-01-04 12:44:07","Article","10.3133/sir20255001","2328-031X","https://api.elsevier.com/content/abstract/scopus_id/85218781980",2025,,,,0,0.00,0,1,1,"","",""
0,"A.A. Peretykin","Soft Zoobenthos of Special Industrial Reservoirs of the Mayak Production Association",2025,"Radiochemistry","","https://www.scopus.com/inward/record.uri?partnerID=HzOxMe3b&scp=105024756685&origin=inward","https://www.scopus.com/inward/citedby.uri?partnerID=HzOxMe3b&scp=105024756685&origin=inward",104,"2026-01-04 12:44:07","Article","10.1134/S1066362225050194","1066-3622","https://api.elsevier.com/content/abstract/scopus_id/105024756685",67,5,737,748,0,0.00,0,1,1,"","",""
1,"M. Vilenica","Spatial patterns of Trichoptera diversity and assemblage structure in the Mediterranean Dinaric karst intermittent rivers in the Western Balkans",2025,"Aquatic Ecology","","https://www.scopus.com/inward/record.uri?partnerID=HzOxMe3b&scp=105002166356&origin=inward","https://www.scopus.com/inward/citedby.uri?partnerID=HzOxMe3b&scp=105002166356&origin=inward",80,"2026-01-04 12:44:07","Article","10.1007/s10452-025-10192-z","1386-2588","https://api.elsevier.com/content/abstract/scopus_id/105002166356",59,2,741,753,1,1.00,1,1,1,"","",""
1,"B.S. Dewenter","Spatial scale influences relationships between indices of organisms’ thermal tolerance",2025,"Journal of Thermal Biology","","https://api.elsevier.com/content/article/eid/1-s2.0-S0306456525001834","https://www.scopus.com/inward/citedby.uri?partnerID=HzOxMe3b&scp=105013959848&origin=inward",33,"2026-01-04 12:44:07","Article","10.1016/j.jtherbio.2025.104226","0306-4565","https://api.elsevier.com/content/abstract/scopus_id/105013959848",132,,,,1,1.00,1,1,1,"","",""
0,"D. Vimos-Lojano","Spatial-temporal distributions of macroinvertebrate communities in high-mountain tropical lakes of Ecuador",2025,"Hydrobiologia","","https://www.scopus.com/inward/record.uri?partnerID=HzOxMe3b&scp=105001943095&origin=inward","https://www.scopus.com/inward/citedby.uri?partnerID=HzOxMe3b&scp=105001943095&origin=inward",137,"2026-01-04 12:44:07","Article","10.1007/s10750-025-05847-9","0018-8158","https://api.elsevier.com/content/abstract/scopus_id/105001943095",852,16,4029,4051,0,0.00,0,1,1,"","",""
1,"G. Liu","Standardized diversity estimation uncovers global distribution patterns and drivers of stream insects",2025,"Npj Biodiversity","","https://www.scopus.com/inward/record.uri?partnerID=HzOxMe3b&scp=105010438201&origin=inward","https://www.scopus.com/inward/citedby.uri?partnerID=HzOxMe3b&scp=105010438201&origin=inward",37,"2026-01-04 12:44:07","Article","10.1038/s44185-025-00098-2","2731-4243","https://api.elsevier.com/content/abstract/scopus_id/105010438201",4,1,,,1,1.00,1,1,1,"","",""
1,"M. McKenzie","Stream Invertebrate Responses to Fine Sediment Depend on the Organic and Inorganic Components",2025,"Freshwater Biology","","https://www.scopus.com/inward/record.uri?partnerID=HzOxMe3b&scp=105001970833&origin=inward","https://www.scopus.com/inward/citedby.uri?partnerID=HzOxMe3b&scp=105001970833&origin=inward",66,"2026-01-04 12:44:07","Article","10.1111/fwb.70022","0046-5070","https://api.elsevier.com/content/abstract/scopus_id/105001970833",70,3,,,1,1.00,1,1,1,"","",""
1,"M.M. Wozniak","Stream macroinvertebrate associations with water chemistry and habitat in low-gradient basins with minimal anthropogenic land use",2025,"Hydrobiologia","","https://www.scopus.com/inward/record.uri?partnerID=HzOxMe3b&scp=105004574258&origin=inward","https://www.scopus.com/inward/citedby.uri?partnerID=HzOxMe3b&scp=105004574258&origin=inward",70,"2026-01-04 12:44:07","Article","10.1007/s10750-025-05880-8","0018-8158","https://api.elsevier.com/content/abstract/scopus_id/105004574258",852,18,4621,4636,1,1.00,1,1,1,"","",""
1,"A. Chakrovorty","Structure and morphology of antennal and palpal sensilla of adult long-horned caddisfly species Triplectides indicus (Walker 1852) (Insecta: Trichoptera: Leptoceridae): a scanning electron microscopy study",2025,"Zoomorphology","","https://www.scopus.com/inward/record.uri?partnerID=HzOxMe3b&scp=105001637105&origin=inward","https://www.scopus.com/inward/citedby.uri?partnerID=HzOxMe3b&scp=105001637105&origin=inward",69,"2026-01-04 12:44:07","Article","10.1007/s00435-025-00716-4","0720-213X","https://api.elsevier.com/content/abstract/scopus_id/105001637105",144,2,,,1,1.00,1,1,1,"","",""
0,"I.C. Rocha","Systematics, divergence dating and historical biogeography of Ochrotrichiinae (Trichoptera: Hydroptilidae) based on morphological and molecular data",2025,"Systematic Entomology","","https://www.scopus.com/inward/record.uri?partnerID=HzOxMe3b&scp=105011055216&origin=inward","https://www.scopus.com/inward/citedby.uri?partnerID=HzOxMe3b&scp=105011055216&origin=inward",135,"2026-01-04 12:44:07","Article","10.1111/syen.12695","0307-6970","https://api.elsevier.com/content/abstract/scopus_id/105011055216",50,4,1005,1024,0,0.00,0,1,1,"","",""
2,"J.S. Stark","Temporal monitoring of genetic diversity in aquatic insects: a pilot study in the Bavarian Forest National Park",2025,"Zookeys","","https://www.scopus.com/inward/record.uri?partnerID=HzOxMe3b&scp=105024226846&origin=inward","https://www.scopus.com/inward/citedby.uri?partnerID=HzOxMe3b&scp=105024226846&origin=inward",27,"2026-01-04 12:44:07","Article","10.3897/zookeys.1263.147797","1313-2989","https://api.elsevier.com/content/abstract/scopus_id/105024226846",,1263,499,518,2,2.00,2,1,1,"","",""
0,"S. Harrison","The Citizen Science Stream Index - a simple and effective citizen science biomonitoring protocol using six key macroinvertebrate indicator taxa",2025,"Science of the Total Environment","","https://api.elsevier.com/content/article/eid/1-s2.0-S0048969725026427","https://www.scopus.com/inward/citedby.uri?partnerID=HzOxMe3b&scp=105022870183&origin=inward",194,"2026-01-04 12:44:07","Article","10.1016/j.scitotenv.2025.181002","0048-9697","https://api.elsevier.com/content/abstract/scopus_id/105022870183",1009,,,,0,0.00,0,1,1,"","",""
0,"N.K.S. Helland","The distribution of Ephemeroptera, Plecoptera and Trichoptera in a Norwegian alpine catchment in relation to environmental gradients",2025,"Aquatic Insects","","https://www.scopus.com/inward/record.uri?partnerID=HzOxMe3b&scp=105009008162&origin=inward","https://www.scopus.com/inward/citedby.uri?partnerID=HzOxMe3b&scp=105009008162&origin=inward",99,"2026-01-04 12:44:07","Article","10.1080/01650424.2025.2510702","0165-0424","https://api.elsevier.com/content/abstract/scopus_id/105009008162",,,,,0,0.00,0,1,1,"","",""
0,"P.B. Frandsen","The early evolution of caddisflies: Milne and Milne revisited",2025,"Zookeys","","https://www.scopus.com/inward/record.uri?partnerID=HzOxMe3b&scp=105024968599&origin=inward","https://www.scopus.com/inward/citedby.uri?partnerID=HzOxMe3b&scp=105024968599&origin=inward",191,"2026-01-04 12:44:07","Conference Paper","10.3897/zookeys.1263.148088","1313-2989","https://api.elsevier.com/content/abstract/scopus_id/105024968599",,1263,37,46,0,0.00,0,1,1,"","",""
6,"A. Peredo Arce","The effect of riparian forest on landscape connectivity for the EPT community across European regions",2025,"Hydrobiologia","","https://www.scopus.com/inward/record.uri?partnerID=HzOxMe3b&scp=85171733958&origin=inward","https://www.scopus.com/inward/citedby.uri?partnerID=HzOxMe3b&scp=85171733958&origin=inward",4,"2026-01-04 12:44:07","Article","10.1007/s10750-023-05353-w","0018-8158","https://api.elsevier.com/content/abstract/scopus_id/85171733958",852,19,4849,4866,6,6.00,6,1,1,"","",""
1,"P. Simović","The Effects of Data Quality on Deep Learning Performance for Aquatic Insect Identification: Advances for Biomonitoring Studies",2025,"Water Switzerland","","https://www.scopus.com/inward/record.uri?partnerID=HzOxMe3b&scp=85214496780&origin=inward","https://www.scopus.com/inward/citedby.uri?partnerID=HzOxMe3b&scp=85214496780&origin=inward",49,"2026-01-04 12:44:07","Article","10.3390/w17010021","2073-4441","https://api.elsevier.com/content/abstract/scopus_id/85214496780",17,1,,,1,1.00,1,1,1,"","",""
1,"E. Rázuri-Gonzales","The genus Atopsyche (Trichoptera, Hydrobiosidae) in Peru, with the description of seven new species",2025,"Zookeys","","https://www.scopus.com/inward/record.uri?partnerID=HzOxMe3b&scp=105024192001&origin=inward","https://www.scopus.com/inward/citedby.uri?partnerID=HzOxMe3b&scp=105024192001&origin=inward",84,"2026-01-04 12:44:07","Article","10.3897/zookeys.1263.150396","1313-2989","https://api.elsevier.com/content/abstract/scopus_id/105024192001",,1263,441,478,1,1.00,1,1,1,"","",""
0,"I. Vučković","The impact of human activities on composition and distribution of caddisfly larval communities (Insecta: Trichoptera) in the Mediterranean karst river system on the eastern Adriatic coast",2025,"Ecologica Montenegrina","","https://www.scopus.com/inward/record.uri?partnerID=HzOxMe3b&scp=105003095294&origin=inward","https://www.scopus.com/inward/citedby.uri?partnerID=HzOxMe3b&scp=105003095294&origin=inward",113,"2026-01-04 12:44:07","Article","10.37828/em.2025.84.8","2337-0173","https://api.elsevier.com/content/abstract/scopus_id/105003095294",84,,83,102,0,0.00,0,1,1,"","",""
0,"Y. Liu","The interactive effects of damming and urbanization on multitrophic aquatic communities in a highly populated watershed in China",2025,"Ecological Indicators","","https://api.elsevier.com/content/article/eid/1-s2.0-S1470160X25012956","https://www.scopus.com/inward/citedby.uri?partnerID=HzOxMe3b&scp=105020967528&origin=inward",148,"2026-01-04 12:44:07","Article","10.1016/j.ecolind.2025.114363","1470-160X","https://api.elsevier.com/content/abstract/scopus_id/105020967528",180,,,,0,0.00,0,1,1,"","",""
0,"M. Valladolid","The Rhyacophila fasciata Species Complex (Trichoptera: Rhyacophilidae) in France and Switzerland, with description of a new species, Rhyacophila caussensis Valladolid & Coppa sp. nov. from France, based on morphological, genetic and ecological evidence",2025,"Zootaxa","","https://www.scopus.com/inward/record.uri?partnerID=HzOxMe3b&scp=105015775557&origin=inward","https://www.scopus.com/inward/citedby.uri?partnerID=HzOxMe3b&scp=105015775557&origin=inward",112,"2026-01-04 12:44:07","Article","10.11646/zootaxa.5692.3.1","1175-5326","https://api.elsevier.com/content/abstract/scopus_id/105015775557",5692,3,401,445,0,0.00,0,1,1,"","",""
0,"Ö. Erdoğan","The Trichoptera fauna of the Karpuz Stream and its relationships with water quality",2025,"Biologia","","https://www.scopus.com/inward/record.uri?partnerID=HzOxMe3b&scp=85217204166&origin=inward","https://www.scopus.com/inward/citedby.uri?partnerID=HzOxMe3b&scp=85217204166&origin=inward",145,"2026-01-04 12:44:07","Article","10.1007/s11756-025-01870-2","0006-3088","https://api.elsevier.com/content/abstract/scopus_id/85217204166",80,3,641,653,0,0.00,0,1,1,"","",""
4,"S.I. Melnitsky","Three new species of Plectrocnemia Stephens, 1836 (Trichoptera: Polycentropodidae) from Rovno amber",2025,"Ecologica Montenegrina","","https://www.scopus.com/inward/record.uri?partnerID=HzOxMe3b&scp=105008878772&origin=inward","https://www.scopus.com/inward/citedby.uri?partnerID=HzOxMe3b&scp=105008878772&origin=inward",6,"2026-01-04 12:44:07","Article","10.37828/em.2025.87.4","2337-0173","https://api.elsevier.com/content/abstract/scopus_id/105008878772",87,,90,100,4,4.00,4,1,1,"","",""
0,"N. Kawase","Three new species of the Rhyacophila retracta species group (Trichoptera, Rhyacophilidae) from Japan",2025,"Zootaxa","","https://www.scopus.com/inward/record.uri?partnerID=HzOxMe3b&scp=105019730224&origin=inward","https://www.scopus.com/inward/citedby.uri?partnerID=HzOxMe3b&scp=105019730224&origin=inward",120,"2026-01-04 12:44:07","Article","10.11646/zootaxa.5691.3.6","1175-5326","https://api.elsevier.com/content/abstract/scopus_id/105019730224",5691,3,561,578,0,0.00,0,1,1,"","",""
1,"B. Bergerot","Tightly intertwined: Waterscapes prompt urgent reconsideration of aquatic insects and their role in agricultural landscapes",2025,"Science of the Total Environment","","https://api.elsevier.com/content/article/eid/1-s2.0-S0048969725003626","https://www.scopus.com/inward/citedby.uri?partnerID=HzOxMe3b&scp=85216960113&origin=inward",30,"2026-01-04 12:44:07","Note","10.1016/j.scitotenv.2025.178728","0048-9697","https://api.elsevier.com/content/abstract/scopus_id/85216960113",966,,,,1,1.00,1,1,1,"","",""
2,"H. Ibrahimi","Tinodes lumbardhi sp. nov. (Trichoptera, Psychomyiidae), a new species from the Lumbardhi i Deçanit River in Kosovo",2025,"Biodiversity Data Journal","","https://www.scopus.com/inward/record.uri?partnerID=HzOxMe3b&scp=85217802554&origin=inward","https://www.scopus.com/inward/citedby.uri?partnerID=HzOxMe3b&scp=85217802554&origin=inward",19,"2026-01-04 12:44:07","Article","10.3897/BDJ.13.e143104","1314-2828","https://api.elsevier.com/content/abstract/scopus_id/85217802554",13,,,,2,2.00,2,1,1,"","",""
1,"P.B. Frandsen","Trichoptera systematics: Past, present, and future - Making the case for continued caddisfly taxonomic research",2025,"Insect Systematics and Diversity","","https://www.scopus.com/inward/record.uri?partnerID=HzOxMe3b&scp=105009931061&origin=inward","https://www.scopus.com/inward/citedby.uri?partnerID=HzOxMe3b&scp=105009931061&origin=inward",35,"2026-01-04 12:44:07","Review","10.1093/isd/ixaf023","2399-3421","https://api.elsevier.com/content/abstract/scopus_id/105009931061",9,3,,,1,1.00,1,1,1,"","",""
1,"S.R.M. Couceiro","Trichoptera, Odonata, and Diptera as Efficient Surrogate Taxa for Monitoring Macroinvertebrate Assemblages in Urban Amazonian Streams",2025,"International Review of Hydrobiology","","https://www.scopus.com/inward/record.uri?partnerID=HzOxMe3b&scp=105008412228&origin=inward","https://www.scopus.com/inward/citedby.uri?partnerID=HzOxMe3b&scp=105008412228&origin=inward",79,"2026-01-04 12:44:07","Article","10.1002/iroh.70015","1434-2944","https://api.elsevier.com/content/abstract/scopus_id/105008412228",110,2,33,41,1,1.00,1,1,1,"","",""
1,"V. Zumr","Two-Year Post-Fire Abundance of Arthropod Groups Across Different Types of Forest in Temperate Central Europe",2025,"Fire","","https://www.scopus.com/inward/record.uri?partnerID=HzOxMe3b&scp=105014512684&origin=inward","https://www.scopus.com/inward/citedby.uri?partnerID=HzOxMe3b&scp=105014512684&origin=inward",55,"2026-01-04 12:44:07","Article","10.3390/fire8080305","2571-6255","https://api.elsevier.com/content/abstract/scopus_id/105014512684",8,8,,,1,1.00,1,1,1,"","",""
1,"S. Standring","Unraveling the genetics of underwater caddisfly silk",2025,"Trends in Genetics","","https://api.elsevier.com/content/article/eid/1-s2.0-S0168952525000046","https://www.scopus.com/inward/citedby.uri?partnerID=HzOxMe3b&scp=85216659026&origin=inward",81,"2026-01-04 12:44:07","Review","10.1016/j.tig.2025.01.004","0168-9525","https://api.elsevier.com/content/abstract/scopus_id/85216659026",41,6,537,546,1,1.00,1,1,1,"","",""
