Cites,Authors,Title,Year,Source,Publisher,ArticleURL,CitesURL,GSRank,QueryDate,Type,DOI,ISSN,CitationURL,Volume,Issue,StartPage,EndPage,ECC,CitesPerYear,CitesPerAuthor,AuthorCount,Age,Abstract,FullTextURL,RelatedURL
0,"L. Peng","A checklist of the Caddisflies (Insecta: Trichoptera) from the Yintiaoling Nature Reserve of China, with description of one new species",2025,"Zootaxa","","https://www.scopus.com/inward/record.uri?partnerID=HzOxMe3b&scp=105008986052&origin=inward","https://www.scopus.com/inward/citedby.uri?partnerID=HzOxMe3b&scp=105008986052&origin=inward",127,"2026-01-04 12:44:07","Article","10.11646/zootaxa.5652.1.6","1175-5326","https://api.elsevier.com/content/abstract/scopus_id/105008986052",5652,1,45,65,0,0.00,0,1,1,"","",""
1,"A.F. Hiemstra","A curious case: caddisfly cases built from brick and sewage overflow microplastics",2025,"Journal of Limnology","","https://www.scopus.com/inward/record.uri?partnerID=HzOxMe3b&scp=105006928371&origin=inward","https://www.scopus.com/inward/citedby.uri?partnerID=HzOxMe3b&scp=105006928371&origin=inward",83,"2026-01-04 12:44:07","Article","10.4081/jlimnol.2025.2212","1129-5767","https://api.elsevier.com/content/abstract/scopus_id/105006928371",84,,,,1,1.00,1,1,1,"","",""
0,"V. de Araujo Barbosa","A Landscape Genetics Approach Reveals Species-Specific Connectivity Patterns for Stream Insects in Fragmented Habitats",2025,"Ecology and Evolution","","https://www.scopus.com/inward/record.uri?partnerID=HzOxMe3b&scp=105000137709&origin=inward","https://www.scopus.com/inward/citedby.uri?partnerID=HzOxMe3b&scp=105000137709&origin=inward",132,"2026-01-04 12:44:07","Article","10.1002/ece3.71084","2045-7758","https://api.elsevier.com/content/abstract/scopus_id/105000137709",15,3,,,0,0.00,0,1,1,"","",""
2,"I.D. Sukatsheva","A New Caddisfly Species Cladochorista uralica sp. nov. (Insecta, Trichoptera: Cladochoristidae) from the Upper Permian of Vyazovka, Orenburg Region, Russia",2025,"Paleontological Journal","","https://www.scopus.com/inward/record.uri?partnerID=HzOxMe3b&scp=105004360285&origin=inward","https://www.scopus.com/inward/citedby.uri?partnerID=HzOxMe3b&scp=105004360285&origin=inward",16,"2026-01-04 12:44:07","Article","10.1134/S0031030124601506","0031-0301","https://api.elsevier.com/content/abstract/scopus_id/105004360285",59,1,56,60,2,2.00,2,1,1,"","",""
0,"H. Ibrahimi","A new Drusinae from Iran: Drusus iani sp. nov. and molecular insights into the Drusus simplex Species Complex (Trichoptera: Limnephilidae)",2025,"Zootaxa","","https://www.scopus.com/inward/record.uri?partnerID=HzOxMe3b&scp=105022267787&origin=inward","https://www.scopus.com/inward/citedby.uri?partnerID=HzOxMe3b&scp=105022267787&origin=inward",187,"2026-01-04 12:44:07","Article","10.11646/zootaxa.5716.3.5","1175-5326","https://api.elsevier.com/content/abstract/scopus_id/105022267787",5716,3,382,396,0,0.00,0,1,1,"","",""
1,"F.B. Quinteiro","A new species of Oecetis McLachlan, 1877 (Trichoptera, Leptoceridae) and new distributional records of Trichoptera in the eastern Amazon",2025,"Zookeys","","https://www.scopus.com/inward/record.uri?partnerID=HzOxMe3b&scp=105024192135&origin=inward","https://www.scopus.com/inward/citedby.uri?partnerID=HzOxMe3b&scp=105024192135&origin=inward",40,"2026-01-04 12:44:07","Article","10.3897/zookeys.1263.151613","1313-2989","https://api.elsevier.com/content/abstract/scopus_id/105024192135",,1263,365,377,1,1.00,1,1,1,"","",""
1,"A.F. Taybi","A new species of Tinodes Curtis, 1834 (Trichoptera: Psychomyiidae) from Ifrane National Park, Morocco",2025,"Ecologica Montenegrina","","https://www.scopus.com/inward/record.uri?partnerID=HzOxMe3b&scp=105021132566&origin=inward","https://www.scopus.com/inward/citedby.uri?partnerID=HzOxMe3b&scp=105021132566&origin=inward",73,"2026-01-04 12:44:07","Article","10.37828/em.2025.88.7","2337-0173","https://api.elsevier.com/content/abstract/scopus_id/105021132566",88,,71,79,1,1.00,1,1,1,"","",""
0,"Y. Imada","Absence of fibroin H sequences and a significant divergence in the putative fibroin L homolog in Neomicropteryx cornuta (Micropterigidae) silk",2025,"Communications Biology","","https://www.scopus.com/inward/record.uri?partnerID=HzOxMe3b&scp=105000175702&origin=inward","https://www.scopus.com/inward/citedby.uri?partnerID=HzOxMe3b&scp=105000175702&origin=inward",189,"2026-01-04 12:44:07","Article","10.1038/s42003-025-07801-w","2399-3642","https://api.elsevier.com/content/abstract/scopus_id/105000175702",8,1,,,0,0.00,0,1,1,"","",""
1,"R.E. Thomson","Additions to the genus Rhyacopsyche Müller, 1879 (Trichoptera, Hydroptilidae) in Ecuador",2025,"Zookeys","","https://www.scopus.com/inward/record.uri?partnerID=HzOxMe3b&scp=105024248988&origin=inward","https://www.scopus.com/inward/citedby.uri?partnerID=HzOxMe3b&scp=105024248988&origin=inward",28,"2026-01-04 12:44:07","Article","10.3897/zookeys.1263.148084","1313-2989","https://api.elsevier.com/content/abstract/scopus_id/105024248988",,1263,531,543,1,1.00,1,1,1,"","",""
0,"G.R. Desidério","Amazonian Discovery Sheds Light on the Evolution of Caenocentron Schmid, 1982 (Trichoptera: Xiphocentronidae): Phylogenetic Placement and Description of a New Species †",2025,"Insects","","https://www.scopus.com/inward/record.uri?partnerID=HzOxMe3b&scp=105026026239&origin=inward","https://www.scopus.com/inward/citedby.uri?partnerID=HzOxMe3b&scp=105026026239&origin=inward",100,"2026-01-04 12:44:07","Article","10.3390/insects16121188","2075-4450","https://api.elsevier.com/content/abstract/scopus_id/105026026239",16,12,,,0,0.00,0,1,1,"","",""
1,"P.N. Hogan","An analytical synopsis of caddisfly (Insecta, Trichoptera) taxonomic history and progress in Canada and the United States",2025,"Zookeys","","https://www.scopus.com/inward/record.uri?partnerID=HzOxMe3b&scp=105024960528&origin=inward","https://www.scopus.com/inward/citedby.uri?partnerID=HzOxMe3b&scp=105024960528&origin=inward",43,"2026-01-04 12:44:07","Article","10.3897/zookeys.1263.147986","1313-2989","https://api.elsevier.com/content/abstract/scopus_id/105024960528",,1263,105,122,1,1.00,1,1,1,"","",""
0,"L.A.H. van Kouwen","An empirically derived riparian forest preference index for lowland stream macroinvertebrates",2025,"Ecological Indicators","","https://api.elsevier.com/content/article/eid/1-s2.0-S1470160X25004777","https://www.scopus.com/inward/citedby.uri?partnerID=HzOxMe3b&scp=105004266469&origin=inward",178,"2026-01-04 12:44:07","Article","10.1016/j.ecolind.2025.113547","1470-160X","https://api.elsevier.com/content/abstract/scopus_id/105004266469",175,,,,0,0.00,0,1,1,"","",""
0,"R.G.F. Eich","An overview of campaniform sensilla arrangement and location on hexapod legs",2025,"Arthropod Structure and Development","","https://api.elsevier.com/content/article/eid/1-s2.0-S1467803925000696","https://www.scopus.com/inward/citedby.uri?partnerID=HzOxMe3b&scp=105013127721&origin=inward",167,"2026-01-04 12:44:07","Article","10.1016/j.asd.2025.101477","1467-8039","https://api.elsevier.com/content/abstract/scopus_id/105013127721",88,,,,0,0.00,0,1,1,"","",""
0,"X. Li","Analysis of biological benchmarks for the Chishui River based on benthic integrity assessment",2025,"Water Resources Protection","","https://www.scopus.com/inward/record.uri?partnerID=HzOxMe3b&scp=105012551693&origin=inward","https://www.scopus.com/inward/citedby.uri?partnerID=HzOxMe3b&scp=105012551693&origin=inward",107,"2026-01-04 12:44:07","Article","10.3880/j.issn.1004-6933.2025.02.028","1004-6933","https://api.elsevier.com/content/abstract/scopus_id/105012551693",41,2,242,252,0,0.00,0,1,1,"","",""
1,"J.C. Carrasco-Baquero","Aquatic macroinvertebrates as indicators of water quality in the wetlands of the Chimborazo Wildlife Reserve – Ecuador",2025,"Limnologica","","https://api.elsevier.com/content/article/eid/1-s2.0-S007595112500012X","https://www.scopus.com/inward/citedby.uri?partnerID=HzOxMe3b&scp=86000131803&origin=inward",60,"2026-01-04 12:44:07","Article","10.1016/j.limno.2025.126234","0075-9511","https://api.elsevier.com/content/abstract/scopus_id/86000131803",112,,,,1,1.00,1,1,1,"","",""
2,"S. El Yaagoubi","Assessing the impacts of agricultural practices on ephemeroptera, plecoptera, and trichoptera (EPT) seasonal distribution: A genera-level EPT trait-based study in North Africa's river ecosystems",2025,"Science of the Total Environment","","https://api.elsevier.com/content/article/eid/1-s2.0-S0048969725013944","https://www.scopus.com/inward/citedby.uri?partnerID=HzOxMe3b&scp=105006992907&origin=inward",24,"2026-01-04 12:44:07","Article","10.1016/j.scitotenv.2025.179753","0048-9697","https://api.elsevier.com/content/abstract/scopus_id/105006992907",987,,,,2,2.00,2,1,1,"","",""
1,"H. Bouasria","Assessment of Water Quality by Identification of the Faunal Biodiversity of Oum Errabia River in Morocco",2025,"Egyptian Journal of Aquatic Biology and Fisheries","","https://www.scopus.com/inward/record.uri?partnerID=HzOxMe3b&scp=105006433091&origin=inward","https://www.scopus.com/inward/citedby.uri?partnerID=HzOxMe3b&scp=105006433091&origin=inward",67,"2026-01-04 12:44:07","Article","10.21608/ejabf.2025.426900","1110-6131","https://api.elsevier.com/content/abstract/scopus_id/105006433091",29,3,325,340,1,1.00,1,1,1,"","",""
0,"M. Brkić","Assessment of Water Quality of the Gostelja River Based on the Composition of Macrozoobenthos Communities",2025,"Ribarstvo Croatian Journal of Fisheries","","https://www.scopus.com/inward/record.uri?partnerID=HzOxMe3b&scp=105009958147&origin=inward","https://www.scopus.com/inward/citedby.uri?partnerID=HzOxMe3b&scp=105009958147&origin=inward",150,"2026-01-04 12:44:07","Article","10.2478/cjf-2025-0010","1330-061X","https://api.elsevier.com/content/abstract/scopus_id/105009958147",83,2,93,98,0,0.00,0,1,1,"","",""
0,"Á. Fueyo","Back to life after 50 years: effects of environmental flow restoration on macroinvertebrate biodiversity and river ecological status. A case study of the Valseco stream, Spain",2025,"Restoration Ecology","","https://www.scopus.com/inward/record.uri?partnerID=HzOxMe3b&scp=105015493492&origin=inward","https://www.scopus.com/inward/citedby.uri?partnerID=HzOxMe3b&scp=105015493492&origin=inward",88,"2026-01-04 12:44:07","Article","10.1111/rec.70198","1061-2971","https://api.elsevier.com/content/abstract/scopus_id/105015493492",,,,,0,0.00,0,1,1,"","",""
0,"G.P. Khanal","Benthic macroinvertebrate assemblages foster the ecoregional approach in near-natural streams of the Bhutan Himalaya",2025,"Hydrobiologia","","https://www.scopus.com/inward/record.uri?partnerID=HzOxMe3b&scp=105015201265&origin=inward","https://www.scopus.com/inward/citedby.uri?partnerID=HzOxMe3b&scp=105015201265&origin=inward",126,"2026-01-04 12:44:07","Article","10.1007/s10750-025-05995-y","0018-8158","https://api.elsevier.com/content/abstract/scopus_id/105015201265",,,,,0,0.00,0,1,1,"","",""
0,"A. Queiroz","Beyond caddisflies: biodiversity knowledge shortfalls, environmental gradients, and conservation priority areas of the most biodiverse Brazilian semiarid region",2025,"Journal of Insect Conservation","","https://www.scopus.com/inward/record.uri?partnerID=HzOxMe3b&scp=105017768059&origin=inward","https://www.scopus.com/inward/citedby.uri?partnerID=HzOxMe3b&scp=105017768059&origin=inward",165,"2026-01-04 12:44:07","Article","10.1007/s10841-025-00711-6","1366-638X","https://api.elsevier.com/content/abstract/scopus_id/105017768059",29,5,,,0,0.00,0,1,1,"","",""
0,"J. Huaman Palomino","Bibliometric Analysis of Macroinvertebrates as Bioindicators of Freshwater Quality",2025,"Proceedings of the Laccei International Multi Conference for Engineering Education and Technology","","https://www.scopus.com/inward/record.uri?partnerID=HzOxMe3b&scp=105019306144&origin=inward","https://www.scopus.com/inward/citedby.uri?partnerID=HzOxMe3b&scp=105019306144&origin=inward",174,"2026-01-04 12:44:07","Conference Paper","10.18687/LACCEI2025.1.1.2247","2414-6390","https://api.elsevier.com/content/abstract/scopus_id/105019306144",,2025,,,0,0.00,0,1,1,"","",""
2,"M. Let","Bioaccumulation of Pharmaceutically Active Compounds from Treated Urban Wastewaters in Aquatic Insect Larvae and Aerial Adults",2025,"Environmental Science and Technology","","https://www.scopus.com/inward/record.uri?partnerID=HzOxMe3b&scp=86000148580&origin=inward","https://www.scopus.com/inward/citedby.uri?partnerID=HzOxMe3b&scp=86000148580&origin=inward",20,"2026-01-04 12:44:07","Article","10.1021/acs.est.4c13781","0013-936X","https://api.elsevier.com/content/abstract/scopus_id/86000148580",59,10,5293,5305,2,2.00,2,1,1,"","",""
0,"P. Negi","Bioassessment of water quality in the upland streams of Himalaya, Uttarakhand, India lesser Himalaya, Uttarakhand, India",2025,"Environment Conservation Journal","","https://www.scopus.com/inward/record.uri?partnerID=HzOxMe3b&scp=105003049862&origin=inward","https://www.scopus.com/inward/citedby.uri?partnerID=HzOxMe3b&scp=105003049862&origin=inward",177,"2026-01-04 12:44:07","Article","10.36953/ECJ.29182912","0972-3099","https://api.elsevier.com/content/abstract/scopus_id/105003049862",26,1,194,202,0,0.00,0,1,1,"","",""
0,"A. Lampou","Biogeographical Regions in the Aegean Archipelago: An Assessment for Freshwater Macroinvertebrates",2025,"Journal of Biogeography","","https://www.scopus.com/inward/record.uri?partnerID=HzOxMe3b&scp=105024998415&origin=inward","https://www.scopus.com/inward/citedby.uri?partnerID=HzOxMe3b&scp=105024998415&origin=inward",160,"2026-01-04 12:44:07","Article","10.1111/jbi.70117","0305-0270","https://api.elsevier.com/content/abstract/scopus_id/105024998415",,,,,0,0.00,0,1,1,"","",""
0,"A. Pantiga-Tapia","Biological Evaluation of Water Quality with the BMWP Index in a Section of the Tlapaneco River Affected by Two Rural Communities in the Guerrero Mountains, Mexico",2025,"Environments Mdpi","","https://www.scopus.com/inward/record.uri?partnerID=HzOxMe3b&scp=105001168589&origin=inward","https://www.scopus.com/inward/citedby.uri?partnerID=HzOxMe3b&scp=105001168589&origin=inward",163,"2026-01-04 12:44:07","Article","10.3390/environments12030091","2076-3298","https://api.elsevier.com/content/abstract/scopus_id/105001168589",12,3,,,0,0.00,0,1,1,"","",""
0,"R. Pereira","Caddisfly biodiversity in Pernambuco state, Brazil: overcoming the biodiversity knowledge shortfall and insights into the effects of climate change",2025,"Systematics and Biodiversity","","https://www.scopus.com/inward/record.uri?partnerID=HzOxMe3b&scp=105008686403&origin=inward","https://www.scopus.com/inward/citedby.uri?partnerID=HzOxMe3b&scp=105008686403&origin=inward",87,"2026-01-04 12:44:07","Article","10.1080/14772000.2025.2504482","1477-2000","https://api.elsevier.com/content/abstract/scopus_id/105008686403",23,1,,,0,0.00,0,1,1,"","",""
0,"H. Pfister","Caddisfly larvae (Trichoptera: Limnephilidae) facilitate the uptake of microplastics by a freshwater fish (Ameiurus nebulosus)",2025,"Environmental Pollution","","https://api.elsevier.com/content/article/eid/1-s2.0-S0269749125015076","https://www.scopus.com/inward/citedby.uri?partnerID=HzOxMe3b&scp=105017122067&origin=inward",169,"2026-01-04 12:44:07","Article","10.1016/j.envpol.2025.127133","0269-7491","https://api.elsevier.com/content/abstract/scopus_id/105017122067",385,,,,0,0.00,0,1,1,"","",""
0,"M.M. Urbaniak","Caddisfly Silk-Polycaprolactone Foams: Physicochemical and Biological Properties of Nature-Inspired Biomaterials",2025,"Journal of Functional Biomaterials","","https://www.scopus.com/inward/record.uri?partnerID=HzOxMe3b&scp=105009065896&origin=inward","https://www.scopus.com/inward/citedby.uri?partnerID=HzOxMe3b&scp=105009065896&origin=inward",175,"2026-01-04 12:44:07","Article","10.3390/jfb16060199","2079-4983","https://api.elsevier.com/content/abstract/scopus_id/105009065896",16,6,,,0,0.00,0,1,1,"","",""
1,"A.M.H. De Bruyn","Calibration of a laboratory-based chronic toxicity model to nickel effects on stream invertebrates in the field",2025,"Environmental Toxicology and Chemistry","","https://www.scopus.com/inward/record.uri?partnerID=HzOxMe3b&scp=105017771016&origin=inward","https://www.scopus.com/inward/citedby.uri?partnerID=HzOxMe3b&scp=105017771016&origin=inward",45,"2026-01-04 12:44:07","Article","10.1093/etojnl/vgaf159","0730-7268","https://api.elsevier.com/content/abstract/scopus_id/105017771016",44,10,2972,2982,1,1.00,1,1,1,"","",""
2,"F. Du","Characteristics and paleoenvironmental indications of caddisfly larval cases-stromatolite bioherms in the Lower Cretaceous in Liupanshan Basin, Central China",2025,"Cretaceous Research","","https://api.elsevier.com/content/article/eid/1-s2.0-S0195667124001460","https://www.scopus.com/inward/citedby.uri?partnerID=HzOxMe3b&scp=85201231226&origin=inward",18,"2026-01-04 12:44:07","Article","10.1016/j.cretres.2024.105973","0195-6671","https://api.elsevier.com/content/abstract/scopus_id/85201231226",165,,,,2,2.00,2,1,1,"","",""
0,"N.D. Mundahl","Characterizing Stream Condition with Benthic Macroinvertebrates in Southeastern Minnesota, USA: Agriculture, Channelization, and Karst Geology Impact Lotic Habitats and Communities",2025,"Insects","","https://www.scopus.com/inward/record.uri?partnerID=HzOxMe3b&scp=85215816511&origin=inward","https://www.scopus.com/inward/citedby.uri?partnerID=HzOxMe3b&scp=85215816511&origin=inward",133,"2026-01-04 12:44:07","Article","10.3390/insects16010059","2075-4450","https://api.elsevier.com/content/abstract/scopus_id/85215816511",16,1,,,0,0.00,0,1,1,"","",""
0,"Y. Wang","Chromosome-level genome assembly of the caddisfly Stenopsyche angustata (Insecta: Trichoptera)",2025,"Scientific Data","","https://www.scopus.com/inward/record.uri?partnerID=HzOxMe3b&scp=105014885513&origin=inward","https://www.scopus.com/inward/citedby.uri?partnerID=HzOxMe3b&scp=105014885513&origin=inward",155,"2026-01-04 12:44:07","Data Paper","10.1038/s41597-025-05602-8","2052-4463","https://api.elsevier.com/content/abstract/scopus_id/105014885513",12,1,,,0,0.00,0,1,1,"","",""
1,"D. Tempelman","Citizen science reveals a shift in the commonness and rarity of Trichoptera in the Netherlands",2025,"Zookeys","","https://www.scopus.com/inward/record.uri?partnerID=HzOxMe3b&scp=105024202254&origin=inward","https://www.scopus.com/inward/citedby.uri?partnerID=HzOxMe3b&scp=105024202254&origin=inward",36,"2026-01-04 12:44:07","Article","10.3897/zookeys.1263.147805","1313-2989","https://api.elsevier.com/content/abstract/scopus_id/105024202254",,1263,519,530,1,1.00,1,1,1,"","",""
0,"D. Arfiati","Community Structure of Benthic Macroinvertebrates as Bioindicators of Water Quality in the Upstream Setail River, Banyuwangi, East Java, Indonesia",2025,"Egyptian Journal of Aquatic Biology and Fisheries","","https://www.scopus.com/inward/record.uri?partnerID=HzOxMe3b&scp=105007180505&origin=inward","https://www.scopus.com/inward/citedby.uri?partnerID=HzOxMe3b&scp=105007180505&origin=inward",190,"2026-01-04 12:44:07","Article","10.21608/ejabf.2025.429568","1110-6131","https://api.elsevier.com/content/abstract/scopus_id/105007180505",29,3,1133,1153,0,0.00,0,1,1,"","",""
3,"O.T. Akinpelu","Comparative investigation provides further insights on how riparian deforestation and different land uses impact the distribution of freshwater macroinvertebrates in Nigerian streams",2025,"Ecohydrology and Hydrobiology","","https://api.elsevier.com/content/article/eid/1-s2.0-S1642359324000065","https://www.scopus.com/inward/citedby.uri?partnerID=HzOxMe3b&scp=85184038503&origin=inward",15,"2026-01-04 12:44:07","Article","10.1016/j.ecohyd.2024.01.006","1642-3593","https://api.elsevier.com/content/abstract/scopus_id/85184038503",25,1,90,105,3,3.00,3,1,1,"","",""
0,"J.B.A. Leite","Comparing leaf fragmentation by Phylloicus sp. and Triplectides sp. (Insecta: Trichoptera) in Cerrado stream ecosystems",2025,"International Journal of Tropical Insect Science","","https://www.scopus.com/inward/record.uri?partnerID=HzOxMe3b&scp=105015482335&origin=inward","https://www.scopus.com/inward/citedby.uri?partnerID=HzOxMe3b&scp=105015482335&origin=inward",152,"2026-01-04 12:44:07","Article","10.1007/s42690-025-01598-1","1742-7584","https://api.elsevier.com/content/abstract/scopus_id/105015482335",45,5,2415,2421,0,0.00,0,1,1,"","",""
0,"D. Hárságyi","Connectivity-Driven Assembly of Trichoptera Metacommunities Across River Networks With Different Drying Patterns",2025,"Freshwater Biology","","https://www.scopus.com/inward/record.uri?partnerID=HzOxMe3b&scp=105007075321&origin=inward","https://www.scopus.com/inward/citedby.uri?partnerID=HzOxMe3b&scp=105007075321&origin=inward",199,"2026-01-04 12:44:07","Article","10.1111/fwb.70053","0046-5070","https://api.elsevier.com/content/abstract/scopus_id/105007075321",70,6,,,0,0.00,0,1,1,"","",""
0,"J. Kocot-Zalewska","Contribution to the knowledge of cave-dwelling fauna from the Prokletije Mountains",2025,"International Journal of Speleology","","https://www.scopus.com/inward/record.uri?partnerID=HzOxMe3b&scp=105003848421&origin=inward","https://www.scopus.com/inward/citedby.uri?partnerID=HzOxMe3b&scp=105003848421&origin=inward",161,"2026-01-04 12:44:07","Article","10.5038/1827-806X.ijs2551","0392-6672","https://api.elsevier.com/content/abstract/scopus_id/105003848421",54,1,,,0,0.00,0,1,1,"","",""
1,"H. Ibrahimi","Contribution to the knowledge of the caddisfly fauna (Insecta: Trichoptera) of the Ibër River in Kosovo, with the first record of Hydroptila martini Marshall, 1977",2025,"Journal of Insect Biodiversity and Systematics","","https://www.scopus.com/inward/record.uri?partnerID=HzOxMe3b&scp=105012202172&origin=inward","https://www.scopus.com/inward/citedby.uri?partnerID=HzOxMe3b&scp=105012202172&origin=inward",53,"2026-01-04 12:44:07","Article","10.61186/jibs.11.3.703","2423-8112","https://api.elsevier.com/content/abstract/scopus_id/105012202172",11,3,703,718,1,1.00,1,1,1,"","",""
0,"H. Ibrahimi","Contribution to the knowledge of the caddisfly fauna of Iran with the description of a new species of Hydropsyche Pictet, 1834 (Trichoptera: Hydropsychidae) from Alvand Mountain",2025,"Aquatic Insects","","https://www.scopus.com/inward/record.uri?partnerID=HzOxMe3b&scp=105014104439&origin=inward","https://www.scopus.com/inward/citedby.uri?partnerID=HzOxMe3b&scp=105014104439&origin=inward",186,"2026-01-04 12:44:07","Article","10.1080/01650424.2025.2520776","0165-0424","https://api.elsevier.com/content/abstract/scopus_id/105014104439",,,,,0,0.00,0,1,1,"","",""
0,"","Correction to Recovery and Degradation Drive Changes in the Dispersal Capacity of Stream Macroinvertebrate Communities (Global Change Biology, (2025), 31, 1, 10.1111/gcb.70054)",2025,"Global Change Biology","","https://www.scopus.com/inward/record.uri?partnerID=HzOxMe3b&scp=105017832496&origin=inward","https://www.scopus.com/inward/citedby.uri?partnerID=HzOxMe3b&scp=105017832496&origin=inward",196,"2026-01-04 12:44:07","Erratum","10.1111/gcb.70538","1354-1013","https://api.elsevier.com/content/abstract/scopus_id/105017832496",31,10,,,0,0.00,0,0,1,"","",""
0,"","Correction to: Miocene caddisflies from Australia: iron-rich sediments preserve internal organs, tracheoles, and corneal nanocoating of larvae and pupae",2025,"Zoological Journal of the Linnean Society","","https://www.scopus.com/inward/record.uri?partnerID=HzOxMe3b&scp=85217044647&origin=inward","https://www.scopus.com/inward/citedby.uri?partnerID=HzOxMe3b&scp=85217044647&origin=inward",140,"2026-01-04 12:44:07","Erratum","10.1093/zoolinnean/zlae033","0024-4082","https://api.elsevier.com/content/abstract/scopus_id/85217044647",203,1,,,0,0.00,0,0,1,"","",""
1,"F. Valente-Neto","Cost-effective alternatives to facilitate biomonitoring and bioassessment of neotropical streams",2025,"Science of the Total Environment","","https://api.elsevier.com/content/article/eid/1-s2.0-S0048969725002888","https://www.scopus.com/inward/citedby.uri?partnerID=HzOxMe3b&scp=85216560753&origin=inward",39,"2026-01-04 12:44:07","Article","10.1016/j.scitotenv.2025.178654","0048-9697","https://api.elsevier.com/content/abstract/scopus_id/85216560753",965,,,,1,1.00,1,1,1,"","",""
0,"D. Rana","Current status of Ichthyofaunal diversity of Indravati Stream a tributary of the Bhagirathi River in Uttarkashi",2025,"Environment Conservation Journal","","https://www.scopus.com/inward/record.uri?partnerID=HzOxMe3b&scp=105009920558&origin=inward","https://www.scopus.com/inward/citedby.uri?partnerID=HzOxMe3b&scp=105009920558&origin=inward",151,"2026-01-04 12:44:07","Article","10.36953/ECJ.27602834","0972-3099","https://api.elsevier.com/content/abstract/scopus_id/105009920558",26,2,340,349,0,0.00,0,1,1,"","",""
1,"X. Deng","De Novo Whole Genome Assemblies of Unusual Case-Making Caddisflies (Trichoptera) Highlight Genomic Convergence in the Composition of the Major Silk Gene (h-fibroin)",2025,"Journal of Experimental Zoology Part B Molecular and Developmental Evolution","","https://www.scopus.com/inward/record.uri?partnerID=HzOxMe3b&scp=105005450689&origin=inward","https://www.scopus.com/inward/citedby.uri?partnerID=HzOxMe3b&scp=105005450689&origin=inward",82,"2026-01-04 12:44:07","Article","10.1002/jez.b.23301","1552-5007","https://api.elsevier.com/content/abstract/scopus_id/105005450689",344,7,442,453,1,1.00,1,1,1,"","",""
0,"F.H. Datto-Liberato","Description of the final instar larva of Phylloicus paprockii and morphological notes of Phylloicus angustior (Trichoptera: Calamoceratidae) in the Southeastern region of Brazil",2025,"Zootaxa","","https://www.scopus.com/inward/record.uri?partnerID=HzOxMe3b&scp=105009418290&origin=inward","https://www.scopus.com/inward/citedby.uri?partnerID=HzOxMe3b&scp=105009418290&origin=inward",109,"2026-01-04 12:44:07","Article","10.11646/zootaxa.5653.2.2","1175-5326","https://api.elsevier.com/content/abstract/scopus_id/105009418290",5653,2,196,210,0,0.00,0,1,1,"","",""
