Cites,Authors,Title,Year,Source,Publisher,ArticleURL,CitesURL,GSRank,QueryDate,Type,DOI,ISSN,CitationURL,Volume,Issue,StartPage,EndPage,ECC,CitesPerYear,CitesPerAuthor,AuthorCount,Age,Abstract,FullTextURL,RelatedURL
0,"G. Rasmussen","Food, Growth and Biological Production of the European Eel, Anguilla anguilla, in a Small Stream in Jutland, Denmark",2025,"Hydrobiology","","https://www.scopus.com/inward/record.uri?partnerID=HzOxMe3b&scp=105025953740&origin=inward","https://www.scopus.com/inward/citedby.uri?partnerID=HzOxMe3b&scp=105025953740&origin=inward",138,"2026-01-04 12:44:07","Article","10.3390/hydrobiology4040033","2673-9917","https://api.elsevier.com/content/abstract/scopus_id/105025953740",4,4,,,0,0.00,0,1,1,"","",""
2,"C. Murail","From Stream to Bloom: Exploring the Potential Role of Aquatic Insects for Pollination in Wetland Environments",2025,"Journal of Applied Entomology","","https://www.scopus.com/inward/record.uri?partnerID=HzOxMe3b&scp=85207022657&origin=inward","https://www.scopus.com/inward/citedby.uri?partnerID=HzOxMe3b&scp=85207022657&origin=inward",17,"2026-01-04 12:44:07","Review","10.1111/jen.13359","0931-2048","https://api.elsevier.com/content/abstract/scopus_id/85207022657",149,5,711,724,2,2.00,2,1,1,"","",""
1,"G. Jijón","Gut microbiome composition of Trichoptera larvae across functional feeding groups: a case study from the Provo River, Utah, USA",2025,"Zookeys","","https://www.scopus.com/inward/record.uri?partnerID=HzOxMe3b&scp=105024947967&origin=inward","https://www.scopus.com/inward/citedby.uri?partnerID=HzOxMe3b&scp=105024947967&origin=inward",63,"2026-01-04 12:44:07","Article","10.3897/zookeys.1263.147980","1313-2989","https://api.elsevier.com/content/abstract/scopus_id/105024947967",,1263,165,177,1,1.00,1,1,1,"","",""
3,"A.F. Hiemstra","Half a century of caddisfly casings (Trichoptera) with microplastic from natural history collections",2025,"Science of the Total Environment","","https://api.elsevier.com/content/article/eid/1-s2.0-S0048969725005820","https://www.scopus.com/inward/citedby.uri?partnerID=HzOxMe3b&scp=105001547039&origin=inward",14,"2026-01-04 12:44:07","Article","10.1016/j.scitotenv.2025.178947","0048-9697","https://api.elsevier.com/content/abstract/scopus_id/105001547039",974,,,,3,3.00,3,1,1,"","",""
1,"S.A. Taig","Heatwaves cause relative fitness decline in aquatic insects by altering life history and host–pathogen relationships",2025,"Ecosphere","","https://www.scopus.com/inward/record.uri?partnerID=HzOxMe3b&scp=105002478317&origin=inward","https://www.scopus.com/inward/citedby.uri?partnerID=HzOxMe3b&scp=105002478317&origin=inward",32,"2026-01-04 12:44:07","Article","10.1002/ecs2.70241","2150-8925","https://api.elsevier.com/content/abstract/scopus_id/105002478317",16,4,,,1,1.00,1,1,1,"","",""
0,"E. Barra","High Density of Microplastics in the Caddisfly Larvae Cases",2025,"Environments Mdpi","","https://www.scopus.com/inward/record.uri?partnerID=HzOxMe3b&scp=105020038668&origin=inward","https://www.scopus.com/inward/citedby.uri?partnerID=HzOxMe3b&scp=105020038668&origin=inward",131,"2026-01-04 12:44:07","Article","10.3390/environments12100368","2076-3298","https://api.elsevier.com/content/abstract/scopus_id/105020038668",12,10,,,0,0.00,0,1,1,"","",""
1,"M. Kuemmerlen","Higher predicted climate-change vulnerability for spring-dwelling freshwater biota",2025,"Zookeys","","https://www.scopus.com/inward/record.uri?partnerID=HzOxMe3b&scp=105024189603&origin=inward","https://www.scopus.com/inward/citedby.uri?partnerID=HzOxMe3b&scp=105024189603&origin=inward",31,"2026-01-04 12:44:07","Article","10.3897/zookeys.1263.148253","1313-2989","https://api.elsevier.com/content/abstract/scopus_id/105024189603",,1263,289,315,1,1.00,1,1,1,"","",""
1,"S.R. Park","How Land Use and Hydrological Characteristics Impact Stream Conditions in Impaired Ecosystems",2025,"Land","","https://www.scopus.com/inward/record.uri?partnerID=HzOxMe3b&scp=105003738633&origin=inward","https://www.scopus.com/inward/citedby.uri?partnerID=HzOxMe3b&scp=105003738633&origin=inward",38,"2026-01-04 12:44:07","Article","10.3390/land14040829","2073-445X","https://api.elsevier.com/content/abstract/scopus_id/105003738633",14,4,,,1,1.00,1,1,1,"","",""
0,"C.N. Barasa","Human activities influence on distribution of Ephemeroptera, Plecoptera, and Trichoptera (EPT) in a tropical riverine ecosystem in Kenya",2025,"Journal of Freshwater Ecology","","https://www.scopus.com/inward/record.uri?partnerID=HzOxMe3b&scp=105011983749&origin=inward","https://www.scopus.com/inward/citedby.uri?partnerID=HzOxMe3b&scp=105011983749&origin=inward",182,"2026-01-04 12:44:07","Article","10.1080/02705060.2025.2539125","0270-5060","https://api.elsevier.com/content/abstract/scopus_id/105011983749",40,1,,,0,0.00,0,1,1,"","",""
1,"Y. Mabrouki","Hydroptila angustata Mosely, 1939 (Trichoptera: Hydroptilidae): A significant addition to the Micro-Caddisfly fauna of Northwest Africa",2025,"Journal of Insect Biodiversity and Systematics","","https://www.scopus.com/inward/record.uri?partnerID=HzOxMe3b&scp=105014397372&origin=inward","https://www.scopus.com/inward/citedby.uri?partnerID=HzOxMe3b&scp=105014397372&origin=inward",65,"2026-01-04 12:44:07","Article","10.61186/jibs.11.4.887","2423-8112","https://api.elsevier.com/content/abstract/scopus_id/105014397372",11,4,887,894,1,1.00,1,1,1,"","",""
0,"S. Mañas-Jordá","IberArthro: A free online database compiling taxonomic and distributional data on Ibero-Balearic arthropods",2025,"Ecosistemas","","https://www.scopus.com/inward/record.uri?partnerID=HzOxMe3b&scp=105015555900&origin=inward","https://www.scopus.com/inward/citedby.uri?partnerID=HzOxMe3b&scp=105015555900&origin=inward",118,"2026-01-04 12:44:07","Data Paper","10.7818/ECOS.2955","1697-2473","https://api.elsevier.com/content/abstract/scopus_id/105015555900",34,2,,,0,0.00,0,1,1,"","",""
3,"J.W. Lee","Impact of Environmental Factors of Stream Ecosystems on Aquatic Invertebrate Communities",2025,"Sustainability Switzerland","","https://www.scopus.com/inward/record.uri?partnerID=HzOxMe3b&scp=85217641465&origin=inward","https://www.scopus.com/inward/citedby.uri?partnerID=HzOxMe3b&scp=85217641465&origin=inward",9,"2026-01-04 12:44:07","Article","10.3390/su17031252","2071-1050","https://api.elsevier.com/content/abstract/scopus_id/85217641465",17,3,,,3,3.00,3,1,1,"","",""
0,"J.M. Rivera-Pérez","Industrial impacts on eastern Amazon streams assessment with benthic EPT community, leaf litter decomposition and associated fauna",2025,"Environmental Research","","https://api.elsevier.com/content/article/eid/1-s2.0-S0013935125013799","https://www.scopus.com/inward/citedby.uri?partnerID=HzOxMe3b&scp=105008110872&origin=inward",130,"2026-01-04 12:44:07","Article","10.1016/j.envres.2025.122128","0013-9351","https://api.elsevier.com/content/abstract/scopus_id/105008110872",283,,,,0,0.00,0,1,1,"","",""
0,"S.C. Mouna","Influence of a dam and tributaries on macrobenthos communities and ecological water quality in the Kebir-Rhumel wadi (Northeast Algeria)",2025,"Oceanological and Hydrobiological Studies","","https://www.scopus.com/inward/record.uri?partnerID=HzOxMe3b&scp=105004767066&origin=inward","https://www.scopus.com/inward/citedby.uri?partnerID=HzOxMe3b&scp=105004767066&origin=inward",147,"2026-01-04 12:44:07","Article","10.26881/oahs-2025.1.04","1730-413X","https://api.elsevier.com/content/abstract/scopus_id/105004767066",54,1,33,49,0,0.00,0,1,1,"","",""
0,"D.L. Preston","Influence of water source on alpine stream community structure: linking morphological and metabarcoding approaches",2025,"Aquatic Sciences","","https://www.scopus.com/inward/record.uri?partnerID=HzOxMe3b&scp=85209779421&origin=inward","https://www.scopus.com/inward/citedby.uri?partnerID=HzOxMe3b&scp=85209779421&origin=inward",96,"2026-01-04 12:44:07","Article","10.1007/s00027-024-01134-2","1015-1621","https://api.elsevier.com/content/abstract/scopus_id/85209779421",87,1,,,0,0.00,0,1,1,"","",""
0,"F. Ložek","Integrative effects of warming and contaminants on the physiology and behaviour of coldwater stenotherm caddisflies",2025,"Environmental Toxicology and Pharmacology","","https://api.elsevier.com/content/article/eid/1-s2.0-S1382668925001930","https://www.scopus.com/inward/citedby.uri?partnerID=HzOxMe3b&scp=105016004110&origin=inward",172,"2026-01-04 12:44:07","Article","10.1016/j.etap.2025.104818","1382-6689","https://api.elsevier.com/content/abstract/scopus_id/105016004110",119,,,,0,0.00,0,1,1,"","",""
0,"C. Jaroenchaiwattanachote","Integrative taxonomy and DNA barcoding of Thai Caddisflies (Trichoptera), with the description of a new Species",2025,"Zootaxa","","https://www.scopus.com/inward/record.uri?partnerID=HzOxMe3b&scp=105001133791&origin=inward","https://www.scopus.com/inward/citedby.uri?partnerID=HzOxMe3b&scp=105001133791&origin=inward",90,"2026-01-04 12:44:07","Article","10.11646/zootaxa.5613.2.6","1175-5326","https://api.elsevier.com/content/abstract/scopus_id/105001133791",5613,2,307,322,0,0.00,0,1,1,"","",""
0,"M. Taş-Divrik","Investigation of benthic macroinvertable fauna and some environmental variables in Sızır Waterfall (Gemerek-Sivas)",2025,"Aquatic Research","","https://www.scopus.com/inward/record.uri?partnerID=HzOxMe3b&scp=105022634990&origin=inward","https://www.scopus.com/inward/citedby.uri?partnerID=HzOxMe3b&scp=105022634990&origin=inward",188,"2026-01-04 12:44:07","Article","10.3153/AR25002","2618-6365","https://api.elsevier.com/content/abstract/scopus_id/105022634990",8,1,12,25,0,0.00,0,1,1,"","",""
1,"M. Šamulková","Is the DNA barcode database fit for purpose? Assessing the feasibility of reverse taxonomy in five key aquatic insect orders relevant to freshwater biomonitoring under the Water Framework Directive",2025,"Biologia","","https://www.scopus.com/inward/record.uri?partnerID=HzOxMe3b&scp=105010121223&origin=inward","https://www.scopus.com/inward/citedby.uri?partnerID=HzOxMe3b&scp=105010121223&origin=inward",41,"2026-01-04 12:44:07","Article","10.1007/s11756-025-01999-0","0006-3088","https://api.elsevier.com/content/abstract/scopus_id/105010121223",80,10,2733,2742,1,1.00,1,1,1,"","",""
0,"T. Latorre-Beltrán","Lateral and longitudinal dispersal of aquatic insects in mountain streams, with notes about Trichoptera",2025,"Zookeys","","https://www.scopus.com/inward/record.uri?partnerID=HzOxMe3b&scp=105024205842&origin=inward","https://www.scopus.com/inward/citedby.uri?partnerID=HzOxMe3b&scp=105024205842&origin=inward",123,"2026-01-04 12:44:07","Article","10.3897/zookeys.1263.150229","1313-2989","https://api.elsevier.com/content/abstract/scopus_id/105024205842",,1263,317,331,0,0.00,0,1,1,"","",""
1,"P. Acharya","Leaf Conditioning and Shredder Activity Shape Microbial Dynamics on Fine Particulate Organic Matter Produced During Decomposition of Different Leaf Litter in Streams",2025,"Microbial Ecology","","https://www.scopus.com/inward/record.uri?partnerID=HzOxMe3b&scp=105000479928&origin=inward","https://www.scopus.com/inward/citedby.uri?partnerID=HzOxMe3b&scp=105000479928&origin=inward",62,"2026-01-04 12:44:07","Article","10.1007/s00248-025-02515-2","0095-3628","https://api.elsevier.com/content/abstract/scopus_id/105000479928",88,1,,,1,1.00,1,1,1,"","",""
0,"D.A. Konovalova","Length-mass relationships and seasonal dynamics of Apatania crymophila McLachlan, 1880 (Trichoptera: Apataniidae) caddisfly larvae associated with water moss in the middle reaches of the Yenisei River (Siberia)",2025,"Aquatic Insects","","https://www.scopus.com/inward/record.uri?partnerID=HzOxMe3b&scp=105001490828&origin=inward","https://www.scopus.com/inward/citedby.uri?partnerID=HzOxMe3b&scp=105001490828&origin=inward",164,"2026-01-04 12:44:07","Article","10.1080/01650424.2024.2407807","0165-0424","https://api.elsevier.com/content/abstract/scopus_id/105001490828",46,1,18,37,0,0.00,0,1,1,"","",""
0,"C.H.A. van Leeuwen","Length–Dry Mass Relationships of Aquatic Insects: Geographic and Taxonomic Variation in a Digital Database",2025,"Freshwater Biology","","https://www.scopus.com/inward/record.uri?partnerID=HzOxMe3b&scp=105009843863&origin=inward","https://www.scopus.com/inward/citedby.uri?partnerID=HzOxMe3b&scp=105009843863&origin=inward",119,"2026-01-04 12:44:07","Article","10.1111/fwb.70056","0046-5070","https://api.elsevier.com/content/abstract/scopus_id/105009843863",70,7,,,0,0.00,0,1,1,"","",""
0,"P. Henrique Monteiro do Amaral","Length–mass relationships of Smicridea (Hydropsychidae, Trichoptera) larvae in a freshwater stream in Brazil",2025,"Studies on Neotropical Fauna and Environment","","https://www.scopus.com/inward/record.uri?partnerID=HzOxMe3b&scp=105007041094&origin=inward","https://www.scopus.com/inward/citedby.uri?partnerID=HzOxMe3b&scp=105007041094&origin=inward",114,"2026-01-04 12:44:07","Article","10.1080/01650521.2025.2501550","0165-0521","https://api.elsevier.com/content/abstract/scopus_id/105007041094",,,,,0,0.00,0,1,1,"","",""
0,"D. Nakano","Life history, voltinism and portable case characteristics of Glossosoma (Trichoptera: Insecta) in the Tama River, Japan",2025,"Limnology","","https://www.scopus.com/inward/record.uri?partnerID=HzOxMe3b&scp=105014612537&origin=inward","https://www.scopus.com/inward/citedby.uri?partnerID=HzOxMe3b&scp=105014612537&origin=inward",171,"2026-01-04 12:44:07","Article","10.1007/s10201-025-00814-8","1439-8621","https://api.elsevier.com/content/abstract/scopus_id/105014612537",,,,,0,0.00,0,1,1,"","",""
1,"D. Simeone","Linking Riparian Forest to the Functional Diversity of Ephemeroptera, Plecoptera, and Trichoptera in First-Order Tropical Streams",2025,"Diversity","","https://www.scopus.com/inward/record.uri?partnerID=HzOxMe3b&scp=105011604890&origin=inward","https://www.scopus.com/inward/citedby.uri?partnerID=HzOxMe3b&scp=105011604890&origin=inward",57,"2026-01-04 12:44:07","Article","10.3390/d17070438","1424-2818","https://api.elsevier.com/content/abstract/scopus_id/105011604890",17,7,,,1,1.00,1,1,1,"","",""
1,"K. Bourne","Local land-use decisions drive losses in river biological integrity to 2099: Using machine learning to disentangle interacting drivers of ecological change in policy forecasts",2025,"Meteorological Applications","","https://www.scopus.com/inward/record.uri?partnerID=HzOxMe3b&scp=85214206504&origin=inward","https://www.scopus.com/inward/citedby.uri?partnerID=HzOxMe3b&scp=85214206504&origin=inward",47,"2026-01-04 12:44:07","Article","10.1002/met.70024","1350-4827","https://api.elsevier.com/content/abstract/scopus_id/85214206504",32,1,,,1,1.00,1,1,1,"","",""
0,"C.G. Ortiz","Macroinvertebrates of semi-arid mountain rivers of San Luis (Argentina): basis for ecological assessment",2025,"Acta Zoologica Lilloana","","https://www.scopus.com/inward/record.uri?partnerID=HzOxMe3b&scp=105024826289&origin=inward","https://www.scopus.com/inward/citedby.uri?partnerID=HzOxMe3b&scp=105024826289&origin=inward",149,"2026-01-04 12:44:07","Article","10.30550/j.azl/2261","0065-1729","https://api.elsevier.com/content/abstract/scopus_id/105024826289",69,2,837,859,0,0.00,0,1,1,"","",""
0,"O.N. Vdovina","Macrozoobenthos as an Indicator of the Ecological State of Lakes in Altai Specially Protected Natural Areas",2025,"Inland Water Biology","","https://www.scopus.com/inward/record.uri?partnerID=HzOxMe3b&scp=105020948446&origin=inward","https://www.scopus.com/inward/citedby.uri?partnerID=HzOxMe3b&scp=105020948446&origin=inward",142,"2026-01-04 12:44:07","Article","10.1134/S1995082925600528","1995-0829","https://api.elsevier.com/content/abstract/scopus_id/105020948446",18,4,849,861,0,0.00,0,1,1,"","",""
1,"P. López Del Castillo","Micro-habitat use and seasonality of caddisfly larvae (Trichoptera) in two streams in eastern Cuba",2025,"Zookeys","","https://www.scopus.com/inward/record.uri?partnerID=HzOxMe3b&scp=105024223404&origin=inward","https://www.scopus.com/inward/citedby.uri?partnerID=HzOxMe3b&scp=105024223404&origin=inward",42,"2026-01-04 12:44:07","Article","10.3897/zookeys.1263.150346","1313-2989","https://api.elsevier.com/content/abstract/scopus_id/105024223404",,1263,333,350,1,1.00,1,1,1,"","",""
0,"M. Ramírez-Carmona","Microcaddisflies (Trichoptera, Hydroptilidae) of the Baja California peninsula, Mexico: checklist and description of two new species",2025,"Zookeys","","https://www.scopus.com/inward/record.uri?partnerID=HzOxMe3b&scp=105024228471&origin=inward","https://www.scopus.com/inward/citedby.uri?partnerID=HzOxMe3b&scp=105024228471&origin=inward",193,"2026-01-04 12:44:07","Article","10.3897/zookeys.1263.148086","1313-2989","https://api.elsevier.com/content/abstract/scopus_id/105024228471",,1263,379,388,0,0.00,0,1,1,"","",""
0,"T.E. Eriksen","Mine-tailings pollution shape riverine macroinvertebrate communities: A case-study from the River Folla",2025,"Fauna Norvegica","","https://www.scopus.com/inward/record.uri?partnerID=HzOxMe3b&scp=105020190672&origin=inward","https://www.scopus.com/inward/citedby.uri?partnerID=HzOxMe3b&scp=105020190672&origin=inward",176,"2026-01-04 12:44:07","Article","10.5324/fn.v44i0.6354","1502-4873","https://api.elsevier.com/content/abstract/scopus_id/105020190672",44,,42,52,0,0.00,0,1,1,"","",""
0,"M.A. Baturina","Monitoring of Zoobenthos as the Basis of the Food Supply for Fish in the Area of Production Activities of the Sredne-Timan Bauxite Mine",2025,"Water Resources","","https://www.scopus.com/inward/record.uri?partnerID=HzOxMe3b&scp=105011283450&origin=inward","https://www.scopus.com/inward/citedby.uri?partnerID=HzOxMe3b&scp=105011283450&origin=inward",173,"2026-01-04 12:44:07","Article","10.1134/S0097807824604898","0097-8078","https://api.elsevier.com/content/abstract/scopus_id/105011283450",52,4,796,806,0,0.00,0,1,1,"","",""
0,"P. Below","Morphological and biomechanical adaptations of larval mandibles in Trichoptera (Insecta)",2025,"Physiological Entomology","","https://www.scopus.com/inward/record.uri?partnerID=HzOxMe3b&scp=105020587513&origin=inward","https://www.scopus.com/inward/citedby.uri?partnerID=HzOxMe3b&scp=105020587513&origin=inward",86,"2026-01-04 12:44:07","Article","10.1111/phen.70009","0307-6962","https://api.elsevier.com/content/abstract/scopus_id/105020587513",,,,,0,0.00,0,1,1,"","",""
1,"M. Hermann","Multiple Stressor Effects of a Neonicotinoid, Heatwaves, and Elevated Temperatures on Aquatic Insect Emergence",2025,"Environmental Science and Technology","","https://www.scopus.com/inward/record.uri?partnerID=HzOxMe3b&scp=105010234291&origin=inward","https://www.scopus.com/inward/citedby.uri?partnerID=HzOxMe3b&scp=105010234291&origin=inward",48,"2026-01-04 12:44:07","Article","10.1021/acs.est.5c01498","0013-936X","https://api.elsevier.com/content/abstract/scopus_id/105010234291",59,28,14226,14238,1,1.00,1,1,1,"","",""
0,"I.D. Sukatsheva","New Caddisflies (Insecta: Trichoptera, Baissoferidae) from the Lower Cretaceous Locality of Shar-Tologoy, Mongolia",2025,"Paleontological Journal","","https://www.scopus.com/inward/record.uri?partnerID=HzOxMe3b&scp=105018809842&origin=inward","https://www.scopus.com/inward/citedby.uri?partnerID=HzOxMe3b&scp=105018809842&origin=inward",198,"2026-01-04 12:44:07","Article","10.1134/S003103012560043X","0031-0301","https://api.elsevier.com/content/abstract/scopus_id/105018809842",59,4,401,405,0,0.00,0,1,1,"","",""
2,"H. Bozdoğan","New caddisfly records (Insecta, Trichoptera) for Montenegro and Ecoregion 5, Dinaric Western Balkans: distributional and ecological insights",2025,"Biodiversity Data Journal","","https://www.scopus.com/inward/record.uri?partnerID=HzOxMe3b&scp=105001565734&origin=inward","https://www.scopus.com/inward/citedby.uri?partnerID=HzOxMe3b&scp=105001565734&origin=inward",22,"2026-01-04 12:44:07","Article","10.3897/BDJ.13.e146076","1314-2828","https://api.elsevier.com/content/abstract/scopus_id/105001565734",13,,1,19,2,2.00,2,1,1,"","",""
0,"H. Ibrahimi","New distributional records of caddisflies (Insecta: Trichoptera) from Kosovo with the first record of Hydroptila vectis Curtis, 1834",2025,"Journal of the Entomological Research Society","","https://www.scopus.com/inward/record.uri?partnerID=HzOxMe3b&scp=105002134382&origin=inward","https://www.scopus.com/inward/citedby.uri?partnerID=HzOxMe3b&scp=105002134382&origin=inward",195,"2026-01-04 12:44:07","Article","10.51963/jers.v27i1.2807","1302-0250","https://api.elsevier.com/content/abstract/scopus_id/105002134382",27,1,201,209,0,0.00,0,1,1,"","",""
0,"R.W. Holzenthal","New Philopotamidae (Insecta, Trichoptera) from Ecuador: seven new species and updated country checklist",2025,"Zookeys","","https://www.scopus.com/inward/record.uri?partnerID=HzOxMe3b&scp=105024958430&origin=inward","https://www.scopus.com/inward/citedby.uri?partnerID=HzOxMe3b&scp=105024958430&origin=inward",136,"2026-01-04 12:44:07","Article","10.3897/zookeys.1263.147996","1313-2989","https://api.elsevier.com/content/abstract/scopus_id/105024958430",,1263,123,145,0,0.00,0,1,1,"","",""
0,"A. Majeed","New record, redescription and DNA barcodes of genus Cheumatopsyche (Insecta: Trichoptera) from India",2025,"Oriental Insects","","https://www.scopus.com/inward/record.uri?partnerID=HzOxMe3b&scp=105000454933&origin=inward","https://www.scopus.com/inward/citedby.uri?partnerID=HzOxMe3b&scp=105000454933&origin=inward",116,"2026-01-04 12:44:07","Article","10.1080/00305316.2025.2475787","0030-5316","https://api.elsevier.com/content/abstract/scopus_id/105000454933",59,3,390,403,0,0.00,0,1,1,"","",""
0,"M.S. Pandher","New records of Hydropsychinae (Insecta: Trichoptera: Hydropsychidae) from Assam, India",2025,"Zootaxa","","https://www.scopus.com/inward/record.uri?partnerID=HzOxMe3b&scp=85219558518&origin=inward","https://www.scopus.com/inward/citedby.uri?partnerID=HzOxMe3b&scp=85219558518&origin=inward",91,"2026-01-04 12:44:07","Article","10.11646/zootaxa.5594.2.9","1175-5326","https://api.elsevier.com/content/abstract/scopus_id/85219558518",5594,2,377,386,0,0.00,0,1,1,"","",""
0,"T. Ali","New species and a new record of the genus Rhyacophila Pictet, 1834 (Insecta: Trichoptera, Rhyacophilidae) from India",2025,"Zootaxa","","https://www.scopus.com/inward/record.uri?partnerID=HzOxMe3b&scp=105019725512&origin=inward","https://www.scopus.com/inward/citedby.uri?partnerID=HzOxMe3b&scp=105019725512&origin=inward",143,"2026-01-04 12:44:07","Article","10.11646/zootaxa.5701.4.6","1175-5326","https://api.elsevier.com/content/abstract/scopus_id/105019725512",5701,4,492,500,0,0.00,0,1,1,"","",""
0,"A.A. Alves","New species and records of Alisotrichia Flint, 1964 (Trichoptera: Hydroptilidae) from Protected Areas of the state of Minas Gerais, Brazil",2025,"Zoologischer Anzeiger","","https://api.elsevier.com/content/article/eid/1-s2.0-S004452312500035X","https://www.scopus.com/inward/citedby.uri?partnerID=HzOxMe3b&scp=105003228357&origin=inward",156,"2026-01-04 12:44:07","Article","10.1016/j.jcz.2025.04.002","0044-5231","https://api.elsevier.com/content/abstract/scopus_id/105003228357",316,,150,157,0,0.00,0,1,1,"","",""
0,"V.D. Ivanov","NEW SPECIES AND SUBSPECIES OF THE GENUS APATANIANA (TRICHOPTERA: APATANIIDAE) FROM KAZAKHSTAN AND KYRGYZSTAN",2025,"Far Eastern Entomologist","","https://www.scopus.com/inward/record.uri?partnerID=HzOxMe3b&scp=105025948785&origin=inward","https://www.scopus.com/inward/citedby.uri?partnerID=HzOxMe3b&scp=105025948785&origin=inward",110,"2026-01-04 12:44:07","Article","10.25221/fee.536.1","1026-051X","https://api.elsevier.com/content/abstract/scopus_id/105025948785",,536,1,11,0,0.00,0,1,1,"","",""
0,"A.L. Henriques-Oliveira","New species of Notalina Mosely, 1939 (Trichoptera: Leptoceridae) from Chapada Diamantina National Park, Northeast Brazil, with new records of other leptocerids from the Caatinga biome",2025,"European Journal of Taxonomy","","https://www.scopus.com/inward/record.uri?partnerID=HzOxMe3b&scp=105011324288&origin=inward","https://www.scopus.com/inward/citedby.uri?partnerID=HzOxMe3b&scp=105011324288&origin=inward",184,"2026-01-04 12:44:07","Article","10.5852/ejt.2025.1004.2957","2118-9773","https://api.elsevier.com/content/abstract/scopus_id/105011324288",1004,,1,18,0,0.00,0,1,1,"","",""
0,"J.W. Chao","New taxa and wing venation disparity in Vitimotauliidae (Trichoptera) from the Lower Cretaceous Yixian Formation",2025,"Palaeoentomology","","https://www.scopus.com/inward/record.uri?partnerID=HzOxMe3b&scp=105017170810&origin=inward","https://www.scopus.com/inward/citedby.uri?partnerID=HzOxMe3b&scp=105017170810&origin=inward",101,"2026-01-04 12:44:07","Article","10.11646/palaeoentomology.8.4.5","2624-2826","https://api.elsevier.com/content/abstract/scopus_id/105017170810",8,4,370,384,0,0.00,0,1,1,"","",""
0,"R.A. Haack","Nocturnal Flight Periodicity of caddisflies (Trichoptera) Along the Lake Huron Shoreline of Drummond Island, Michigan (USA)",2025,"Great Lakes Entomologist","","https://www.scopus.com/inward/record.uri?partnerID=HzOxMe3b&scp=105024434424&origin=inward","https://www.scopus.com/inward/citedby.uri?partnerID=HzOxMe3b&scp=105024434424&origin=inward",103,"2026-01-04 12:44:07","Article","10.22543/0090-0222.2509","0090-0222","https://api.elsevier.com/content/abstract/scopus_id/105024434424",58,1,20,34,0,0.00,0,1,1,"","",""
0,"G.R. Desidério","On Andean Long-Horned Caddisfly Brachysetodes Schmid, 1955 (Trichoptera: Leptoceridae): Discovery of a New Species, Distribution, and an Identification Key",2025,"Insects","","https://www.scopus.com/inward/record.uri?partnerID=HzOxMe3b&scp=105014354033&origin=inward","https://www.scopus.com/inward/citedby.uri?partnerID=HzOxMe3b&scp=105014354033&origin=inward",168,"2026-01-04 12:44:07","Article","10.3390/insects16080832","2075-4450","https://api.elsevier.com/content/abstract/scopus_id/105014354033",16,8,,,0,0.00,0,1,1,"","",""
