Cites,Authors,Title,Year,Source,Publisher,ArticleURL,CitesURL,GSRank,QueryDate,Type,DOI,ISSN,CitationURL,Volume,Issue,StartPage,EndPage,ECC,CitesPerYear,CitesPerAuthor,AuthorCount,Age,Abstract,FullTextURL,RelatedURL
0,"K.A. Johanson","Description of three new species of Wormaldia McLachlan, 1865 from Vietnam (Trichoptera: Philopotamidae)",2025,"European Journal of Taxonomy","","https://www.scopus.com/inward/record.uri?partnerID=HzOxMe3b&scp=105013269828&origin=inward","https://www.scopus.com/inward/citedby.uri?partnerID=HzOxMe3b&scp=105013269828&origin=inward",141,"2026-01-04 12:44:07","Article","10.5852/ejt.2025.1007.2991","2118-9773","https://api.elsevier.com/content/abstract/scopus_id/105013269828",1007,,24,34,0,0.00,0,1,1,"","",""
0,"X. Ge","Descriptions of hitherto unknown larvae of the genus Hydropsyche Pictet, 1834 from China (Trichoptera, Hydropsychidae)",2025,"Biodiversity Data Journal","","https://www.scopus.com/inward/record.uri?partnerID=HzOxMe3b&scp=105001517175&origin=inward","https://www.scopus.com/inward/citedby.uri?partnerID=HzOxMe3b&scp=105001517175&origin=inward",125,"2026-01-04 12:44:07","Article","10.3897/BDJ.13.E151321","1314-2828","https://api.elsevier.com/content/abstract/scopus_id/105001517175",13,,1,20,0,0.00,0,1,1,"","",""
0,"T. Muluye","Development of ecoregion-specific biomonitoring tools for a tropical river: addressing water quality and ecological connectivity in highland-lowland systems",2025,"Marine Pollution Bulletin","","https://api.elsevier.com/content/article/eid/1-s2.0-S0025326X25010677","https://www.scopus.com/inward/citedby.uri?partnerID=HzOxMe3b&scp=105013199309&origin=inward",129,"2026-01-04 12:44:07","Article","10.1016/j.marpolbul.2025.118591","0025-326X","https://api.elsevier.com/content/abstract/scopus_id/105013199309",221,,,,0,0.00,0,1,1,"","",""
3,"Y.M. Mohammed","Development of macroinvertebrates-based multimetric index to assess the ecological health of a rural river in North-central Nigeria",2025,"Biologia","","https://www.scopus.com/inward/record.uri?partnerID=HzOxMe3b&scp=85209108885&origin=inward","https://www.scopus.com/inward/citedby.uri?partnerID=HzOxMe3b&scp=85209108885&origin=inward",8,"2026-01-04 12:44:07","Article","10.1007/s11756-024-01824-0","0006-3088","https://api.elsevier.com/content/abstract/scopus_id/85209108885",80,2,261,274,3,3.00,3,1,1,"","",""
1,"J. Lancaster","Diet alters interspecific fecundity–size relationships in capital breeding insects",2025,"Oikos","","https://www.scopus.com/inward/record.uri?partnerID=HzOxMe3b&scp=105003920353&origin=inward","https://www.scopus.com/inward/citedby.uri?partnerID=HzOxMe3b&scp=105003920353&origin=inward",58,"2026-01-04 12:44:07","Article","10.1111/oik.10992","0030-1299","https://api.elsevier.com/content/abstract/scopus_id/105003920353",2025,5,,,1,1.00,1,1,1,"","",""
0,"W. Devaa","Diet composition and habitat suitability of rainbow trout streams in Western Ghats, South India: an ecological study",2025,"Current Science","","https://www.scopus.com/inward/record.uri?partnerID=HzOxMe3b&scp=105001045665&origin=inward","https://www.scopus.com/inward/citedby.uri?partnerID=HzOxMe3b&scp=105001045665&origin=inward",111,"2026-01-04 12:44:07","Note","","0011-3891","https://api.elsevier.com/content/abstract/scopus_id/105001045665",128,6,556,557,0,0.00,0,1,1,"","",""
1,"J. Jiang","Diet-microbiome coevolution: the core mechanism for semi-aquatic adaptation and cross-habitat niche coexistence of the web-footed shrew (Nectogale elegans)",2025,"Frontiers in Microbiology","","https://www.scopus.com/inward/record.uri?partnerID=HzOxMe3b&scp=105023709612&origin=inward","https://www.scopus.com/inward/citedby.uri?partnerID=HzOxMe3b&scp=105023709612&origin=inward",72,"2026-01-04 12:44:07","Article","10.3389/fmicb.2025.1711143","1664-302X","https://api.elsevier.com/content/abstract/scopus_id/105023709612",16,,,,1,1.00,1,1,1,"","",""
0,"A.C. Besser","Differential utilization of submerged leaf litter by microbial biofilms and macroinvertebrates in a large dryland river",2025,"Limnology and Oceanography","","https://www.scopus.com/inward/record.uri?partnerID=HzOxMe3b&scp=105018508076&origin=inward","https://www.scopus.com/inward/citedby.uri?partnerID=HzOxMe3b&scp=105018508076&origin=inward",124,"2026-01-04 12:44:07","Article","10.1002/lno.70225","1939-5590","https://api.elsevier.com/content/abstract/scopus_id/105018508076",70,11,3489,3505,0,0.00,0,1,1,"","",""
0,"L.A. Barnes","Differing Impacts of Livestock Farming and Ranching on Aquatic Insect Biodiversity: A Global Meta-Analysis",2025,"Global Change Biology","","https://www.scopus.com/inward/record.uri?partnerID=HzOxMe3b&scp=105016605104&origin=inward","https://www.scopus.com/inward/citedby.uri?partnerID=HzOxMe3b&scp=105016605104&origin=inward",134,"2026-01-04 12:44:07","Review","10.1111/gcb.70513","1354-1013","https://api.elsevier.com/content/abstract/scopus_id/105016605104",31,9,,,0,0.00,0,1,1,"","",""
1,"A.D.L. Viana","Distribution and status of Smicridea McLachlan, 1871 (Trichoptera: Hydropsychidae) in the Rio Doce Basin, Southeastern Brazil a decade after the tailings dam disaster",2025,"Biologia","","https://www.scopus.com/inward/record.uri?partnerID=HzOxMe3b&scp=105023883277&origin=inward","https://www.scopus.com/inward/citedby.uri?partnerID=HzOxMe3b&scp=105023883277&origin=inward",54,"2026-01-04 12:44:07","Article","10.1007/s11756-025-02055-7","0006-3088","https://api.elsevier.com/content/abstract/scopus_id/105023883277",80,12,3431,3457,1,1.00,1,1,1,"","",""
7,"S. El Yaagoubi","Distribution patterns of Ephemeroptera, Plecoptera, and Trichoptera (EPT) species in the northwestern Rif: environmental and climate change impacts",2025,"Hydrobiologia","","https://www.scopus.com/inward/record.uri?partnerID=HzOxMe3b&scp=85211937510&origin=inward","https://www.scopus.com/inward/citedby.uri?partnerID=HzOxMe3b&scp=85211937510&origin=inward",3,"2026-01-04 12:44:07","Article","10.1007/s10750-024-05756-3","0018-8158","https://api.elsevier.com/content/abstract/scopus_id/85211937510",852,6,1575,1593,7,7.00,7,1,1,"","",""
0,"P. Athulya","Diversity and distribution of aquatic insects and their relation to water quality parameters at the selected stations of the Chalakudy River, Kerala, India",2025,"Aquatic Ecology","","https://www.scopus.com/inward/record.uri?partnerID=HzOxMe3b&scp=85217872759&origin=inward","https://www.scopus.com/inward/citedby.uri?partnerID=HzOxMe3b&scp=85217872759&origin=inward",179,"2026-01-04 12:44:07","Article","10.1007/s10452-025-10175-0","1386-2588","https://api.elsevier.com/content/abstract/scopus_id/85217872759",59,2,487,499,0,0.00,0,1,1,"","",""
1,"E. Rázuri-Gonzales","Diversity and distribution of the caddisfly genus Atopsyche Banks, 1905 in Ecuador, with the description of seven new species (Trichoptera: Hydrobiosidae)",2025,"Peerj","","https://www.scopus.com/inward/record.uri?partnerID=HzOxMe3b&scp=105002639909&origin=inward","https://www.scopus.com/inward/citedby.uri?partnerID=HzOxMe3b&scp=105002639909&origin=inward",52,"2026-01-04 12:44:07","Article","10.7717/peerj.18769","2167-8359","https://api.elsevier.com/content/abstract/scopus_id/105002639909",13,4,,,1,1.00,1,1,1,"","",""
1,"A.K. Rasmussen","Diversity and distribution of the Trichoptera of Florida, United States, with descriptions of five new species",2025,"Zookeys","","https://www.scopus.com/inward/record.uri?partnerID=HzOxMe3b&scp=105024196604&origin=inward","https://www.scopus.com/inward/citedby.uri?partnerID=HzOxMe3b&scp=105024196604&origin=inward",46,"2026-01-04 12:44:07","Article","10.3897/zookeys.1263.147317","1313-2989","https://api.elsevier.com/content/abstract/scopus_id/105024196604",,1263,389,439,1,1.00,1,1,1,"","",""
1,"A.G.M.I. Suhri","Diversity and Ecological Role of Aquatic Insects as Bioindicators of Water Quality in Tropical Streams",2025,"Egyptian Journal of Aquatic Biology and Fisheries","","https://www.scopus.com/inward/record.uri?partnerID=HzOxMe3b&scp=105017167255&origin=inward","https://www.scopus.com/inward/citedby.uri?partnerID=HzOxMe3b&scp=105017167255&origin=inward",50,"2026-01-04 12:44:07","Article","10.21608/ejabf.2025.415515.6435","1110-6131","https://api.elsevier.com/content/abstract/scopus_id/105017167255",29,5,403,418,1,1.00,1,1,1,"","",""
0,"A. Sadapotto","Diversity and role of insect in Lantebung mangrove forest, Makassar, Indonesia",2025,"Iop Conference Series Earth and Environmental Science","","https://www.scopus.com/inward/record.uri?partnerID=HzOxMe3b&scp=105023662254&origin=inward","https://www.scopus.com/inward/citedby.uri?partnerID=HzOxMe3b&scp=105023662254&origin=inward",97,"2026-01-04 12:44:07","Conference Paper","10.1088/1755-1315/1553/1/012048","1755-1307","https://api.elsevier.com/content/abstract/scopus_id/105023662254",1553,1,,,0,0.00,0,1,1,"","",""
1,"T.O. Prommi","Diversity of caddisflies (Trichoptera), water quality factors, and microplastics in a northern Thai stream",2025,"Ecologica Montenegrina","","https://www.scopus.com/inward/record.uri?partnerID=HzOxMe3b&scp=105016003979&origin=inward","https://www.scopus.com/inward/citedby.uri?partnerID=HzOxMe3b&scp=105016003979&origin=inward",77,"2026-01-04 12:44:07","Article","10.37828/em.2025.89.8","2337-0173","https://api.elsevier.com/content/abstract/scopus_id/105016003979",89,,140,160,1,1.00,1,1,1,"","",""
1,"S. Gerwin","Diversity of Rhyacophila (Trichoptera, Rhyacophilidae) in the Hengduan Mountains",2025,"Zookeys","","https://www.scopus.com/inward/record.uri?partnerID=HzOxMe3b&scp=105024969454&origin=inward","https://www.scopus.com/inward/citedby.uri?partnerID=HzOxMe3b&scp=105024969454&origin=inward",44,"2026-01-04 12:44:07","Article","10.3897/zookeys.1263.153111","1313-2989","https://api.elsevier.com/content/abstract/scopus_id/105024969454",,1263,69,88,1,1.00,1,1,1,"","",""
2,"P. Tomingas","Diversity of small waterbodies sustains aquatic biodiversity in drained forest landscapes",2025,"Hydrobiologia","","https://www.scopus.com/inward/record.uri?partnerID=HzOxMe3b&scp=86000430752&origin=inward","https://www.scopus.com/inward/citedby.uri?partnerID=HzOxMe3b&scp=86000430752&origin=inward",26,"2026-01-04 12:44:07","Article","10.1007/s10750-024-05770-5","0018-8158","https://api.elsevier.com/content/abstract/scopus_id/86000430752",852,6,1677,1692,2,2.00,2,1,1,"","",""
2,"J.V. Sganga","Diversity of Trichoptera (Insecta) in protected and unprotected areas of the Argentinian Parana and Araucaria Forest provinces",2025,"Journal of Insect Conservation","","https://www.scopus.com/inward/record.uri?partnerID=HzOxMe3b&scp=85211164324&origin=inward","https://www.scopus.com/inward/citedby.uri?partnerID=HzOxMe3b&scp=85211164324&origin=inward",23,"2026-01-04 12:44:07","Article","10.1007/s10841-024-00639-3","1366-638X","https://api.elsevier.com/content/abstract/scopus_id/85211164324",29,1,,,2,2.00,2,1,1,"","",""
1,"Y.Q. Chan","Diversity, abundance and distribution of caddisfly (Insecta, Trichoptera) families in relation to environmental parameters across freshwater streams in Singapore",2025,"Zookeys","","https://www.scopus.com/inward/record.uri?partnerID=HzOxMe3b&scp=105024947142&origin=inward","https://www.scopus.com/inward/citedby.uri?partnerID=HzOxMe3b&scp=105024947142&origin=inward",64,"2026-01-04 12:44:07","Article","10.3897/zookeys.1263.147968","1313-2989","https://api.elsevier.com/content/abstract/scopus_id/105024947142",,1263,21,36,1,1.00,1,1,1,"","",""
0,"A. Majeed","DNA Barcoding and Phylogenetic Studies of Pseudoleptonema quinquefasciatum Martynov 1935 (Hydropsychidae: Trichoptera) from India",2025,"Acta Fytotechnica Et Zootechnica","","https://www.scopus.com/inward/record.uri?partnerID=HzOxMe3b&scp=105016511868&origin=inward","https://www.scopus.com/inward/citedby.uri?partnerID=HzOxMe3b&scp=105016511868&origin=inward",166,"2026-01-04 12:44:07","Article","10.15414/afz.2025.28.02.115-121","1335-258X","https://api.elsevier.com/content/abstract/scopus_id/105016511868",28,2,115,121,0,0.00,0,1,1,"","",""
0,"L.S. Kravtsova","DNA Metabarcoding of Macroinvertebrates in the Biomonitoring System of Lake Baikal",2025,"Biology Bulletin","","https://www.scopus.com/inward/record.uri?partnerID=HzOxMe3b&scp=105005164574&origin=inward","https://www.scopus.com/inward/citedby.uri?partnerID=HzOxMe3b&scp=105005164574&origin=inward",153,"2026-01-04 12:44:07","Article","10.1134/S1062359024611844","1062-3590","https://api.elsevier.com/content/abstract/scopus_id/105005164574",52,1,,,0,0.00,0,1,1,"","",""
0,"W. Meng","DNA metabarcoding-based diet analysis of Salmo trutta fario in the Yadong River",2025,"Journal of Fisheries of China","","https://www.scopus.com/inward/record.uri?partnerID=HzOxMe3b&scp=105018518960&origin=inward","https://www.scopus.com/inward/citedby.uri?partnerID=HzOxMe3b&scp=105018518960&origin=inward",158,"2026-01-04 12:44:07","Article","10.11964/jfc.20240314415","1000-0615","https://api.elsevier.com/content/abstract/scopus_id/105018518960",49,11,,,0,0.00,0,1,1,"","",""
0,"A. Fan","Do freshwater insect assemblages in exotic plantations resemble those from native forest? Evidence from environmental DNA",2025,"Restoration Ecology","","https://www.scopus.com/inward/record.uri?partnerID=HzOxMe3b&scp=105005869632&origin=inward","https://www.scopus.com/inward/citedby.uri?partnerID=HzOxMe3b&scp=105005869632&origin=inward",159,"2026-01-04 12:44:07","Article","10.1111/rec.70091","1061-2971","https://api.elsevier.com/content/abstract/scopus_id/105005869632",33,8,,,0,0.00,0,1,1,"","",""
0,"I. Khaliq","Documenting climate-driven changes in Swiss macroinvertebrate communities with a ‘temperature index’: An evaluation of different sources of thermal preference data",2025,"Ecological Indicators","","https://api.elsevier.com/content/article/eid/1-s2.0-S1470160X25010611","https://www.scopus.com/inward/citedby.uri?partnerID=HzOxMe3b&scp=105014292549&origin=inward",139,"2026-01-04 12:44:07","Article","10.1016/j.ecolind.2025.114129","1470-160X","https://api.elsevier.com/content/abstract/scopus_id/105014292549",178,,,,0,0.00,0,1,1,"","",""
0,"M. Tarkowska-Kukuryk","Ecological health assessment of karstic springs based on the biological integrity of benthic fauna",2025,"Global Ecology and Conservation","","https://api.elsevier.com/content/article/eid/1-s2.0-S2351989425005086","https://www.scopus.com/inward/citedby.uri?partnerID=HzOxMe3b&scp=105019092189&origin=inward",92,"2026-01-04 12:44:07","Article","10.1016/j.gecco.2025.e03907","2351-9894","https://api.elsevier.com/content/abstract/scopus_id/105019092189",63,,,,0,0.00,0,1,1,"","",""
1,"J.C. Marks","Ecosystem consequences of a nitrogen-fixing proto-organelle",2025,"Proceedings of the National Academy of Sciences of the United States of America","","https://www.scopus.com/inward/record.uri?partnerID=HzOxMe3b&scp=105015505993&origin=inward","https://www.scopus.com/inward/citedby.uri?partnerID=HzOxMe3b&scp=105015505993&origin=inward",75,"2026-01-04 12:44:07","Article","10.1073/pnas.2503108122","0027-8424","https://api.elsevier.com/content/abstract/scopus_id/105015505993",122,37,,,1,1.00,1,1,1,"","",""
2,"S. Feng","Effect of Environmental Factors on Macrobenthic Community Structure in Chishui River Basin",2025,"Sustainability Switzerland","","https://www.scopus.com/inward/record.uri?partnerID=HzOxMe3b&scp=85215818743&origin=inward","https://www.scopus.com/inward/citedby.uri?partnerID=HzOxMe3b&scp=85215818743&origin=inward",21,"2026-01-04 12:44:07","Article","10.3390/su17020469","2071-1050","https://api.elsevier.com/content/abstract/scopus_id/85215818743",17,2,,,2,2.00,2,1,1,"","",""
1,"E.E. Diesbourg","Effects of municipal wastewater effluents on the invertebrate microbiomes of an aquatic-riparian food web",2025,"Environmental Pollution","","https://api.elsevier.com/content/article/eid/1-s2.0-S0269749125003215","https://www.scopus.com/inward/citedby.uri?partnerID=HzOxMe3b&scp=85219718351&origin=inward",76,"2026-01-04 12:44:07","Article","10.1016/j.envpol.2025.125948","0269-7491","https://api.elsevier.com/content/abstract/scopus_id/85219718351",372,,,,1,1.00,1,1,1,"","",""
0,"P.N. Mahabir","Environmental and ecological factors, but not agricultural activity, are associated with brain size in creek chub (Semotilus atromaculatus)",2025,"Environmental Biology of Fishes","","https://www.scopus.com/inward/record.uri?partnerID=HzOxMe3b&scp=85211953721&origin=inward","https://www.scopus.com/inward/citedby.uri?partnerID=HzOxMe3b&scp=85211953721&origin=inward",106,"2026-01-04 12:44:07","Article","10.1007/s10641-024-01649-5","0378-1909","https://api.elsevier.com/content/abstract/scopus_id/85211953721",108,1,131,146,0,0.00,0,1,1,"","",""
3,"L.F. Munyai","Environmental characteristics shape macroinvertebrate community structure across spatiotemporal scales in a subtropical African river system",2025,"Scientific Reports","","https://www.scopus.com/inward/record.uri?partnerID=HzOxMe3b&scp=85218693136&origin=inward","https://www.scopus.com/inward/citedby.uri?partnerID=HzOxMe3b&scp=85218693136&origin=inward",11,"2026-01-04 12:44:07","Article","10.1038/s41598-025-91346-9","2045-2322","https://api.elsevier.com/content/abstract/scopus_id/85218693136",15,1,,,3,3.00,3,1,1,"","",""
0,"D.T.B.d.S. Catâneo","Environmental degradation and its consequences for biological diversity in urban streams of the Southwestern Amazon",2025,"Urban Ecosystems","","https://www.scopus.com/inward/record.uri?partnerID=HzOxMe3b&scp=105004678279&origin=inward","https://www.scopus.com/inward/citedby.uri?partnerID=HzOxMe3b&scp=105004678279&origin=inward",121,"2026-01-04 12:44:07","Article","10.1007/s11252-025-01733-3","1083-8155","https://api.elsevier.com/content/abstract/scopus_id/105004678279",28,3,,,0,0.00,0,1,1,"","",""
0,"J. Alvim","EPTDoce: Synthesizing knowledge of EPT fauna of Ephemeroptera, Plecoptera and Trichoptera in the Doce River basin, Brazil",2025,"Hydrobiologia","","https://www.scopus.com/inward/record.uri?partnerID=HzOxMe3b&scp=105019396218&origin=inward","https://www.scopus.com/inward/citedby.uri?partnerID=HzOxMe3b&scp=105019396218&origin=inward",183,"2026-01-04 12:44:07","Article","10.1007/s10750-025-06013-x","0018-8158","https://api.elsevier.com/content/abstract/scopus_id/105019396218",,,,,0,0.00,0,1,1,"","",""
0,"","Erratum to: Environmental DNA supports importance of heterogeneous pond landscapes for arthropod diversity conservation (Ecosphere, (2025), 16, 2, 10.1002/ecs2.70171)",2025,"Ecosphere","","https://www.scopus.com/inward/record.uri?partnerID=HzOxMe3b&scp=105013560225&origin=inward","https://www.scopus.com/inward/citedby.uri?partnerID=HzOxMe3b&scp=105013560225&origin=inward",94,"2026-01-04 12:44:07","Erratum","10.1002/ecs2.70228","2150-8925","https://api.elsevier.com/content/abstract/scopus_id/105013560225",16,7,,,0,0.00,0,0,1,"","",""
3,"Y. Cao","Evaluating machine leaning algorithms for accuracy, stability, and among-predictors discriminability in modeling species-richness across ten datasets",2025,"Ecological Informatics","","https://api.elsevier.com/content/article/eid/1-s2.0-S1574954125003322","https://www.scopus.com/inward/citedby.uri?partnerID=HzOxMe3b&scp=105010514750&origin=inward",7,"2026-01-04 12:44:07","Article","10.1016/j.ecoinf.2025.103323","1574-9541","https://api.elsevier.com/content/abstract/scopus_id/105010514750",90,,,,3,3.00,3,1,1,"","",""
0,"B. Xërxa","Evaluation of the Water Quality of the Prizren River (Kosovo) using Benthic Macroinvertebrates as Bioindicators",2025,"Acta Zoologica Bulgarica","","https://www.scopus.com/inward/record.uri?partnerID=HzOxMe3b&scp=105009921986&origin=inward","https://www.scopus.com/inward/citedby.uri?partnerID=HzOxMe3b&scp=105009921986&origin=inward",192,"2026-01-04 12:44:07","Article","10.71424/azb77.2.002865","0324-0770","https://api.elsevier.com/content/abstract/scopus_id/105009921986",77,2,209,217,0,0.00,0,1,1,"","",""
0,"N. Nongrak","Evidence of microplastic transfer from larvae to adult Amphipsyche meridiana (Hydropsychidae, Trichoptera) in an irrigation canal",2025,"Ecologica Montenegrina","","https://www.scopus.com/inward/record.uri?partnerID=HzOxMe3b&scp=105017976088&origin=inward","https://www.scopus.com/inward/citedby.uri?partnerID=HzOxMe3b&scp=105017976088&origin=inward",102,"2026-01-04 12:44:07","Article","10.37828/em.2025.90.6","2337-0173","https://api.elsevier.com/content/abstract/scopus_id/105017976088",90,,103,117,0,0.00,0,1,1,"","",""
0,"J. Hinić-Jordanovska","Expanding the range: First record and redescription of the male of Limnephilus petri Marinković Gospodnetić, 1966 in R. North Macedonia",2025,"Ecologica Montenegrina","","https://www.scopus.com/inward/record.uri?partnerID=HzOxMe3b&scp=105003122980&origin=inward","https://www.scopus.com/inward/citedby.uri?partnerID=HzOxMe3b&scp=105003122980&origin=inward",181,"2026-01-04 12:44:07","Article","10.37828/em.2025.84.2","2337-0173","https://api.elsevier.com/content/abstract/scopus_id/105003122980",84,,15,24,0,0.00,0,1,1,"","",""
2,"A. Cowell","Experimentally induced low flows indicate climate change may shrink trophic niches of mountain-stream predators",2025,"Freshwater Science","","https://www.scopus.com/inward/record.uri?partnerID=HzOxMe3b&scp=105013022158&origin=inward","https://www.scopus.com/inward/citedby.uri?partnerID=HzOxMe3b&scp=105013022158&origin=inward",25,"2026-01-04 12:44:07","Article","10.1086/737386","2161-9549","https://api.elsevier.com/content/abstract/scopus_id/105013022158",44,3,330,347,2,2.00,2,1,1,"","",""
1,"S. Betz-Koch","Extremely low repeated pyrethroid pulses increase harmful effects on caddisfly larvae (Chaetopteryx villosa) and influence species interactions",2025,"Aquatic Toxicology","","https://api.elsevier.com/content/article/eid/1-s2.0-S0166445X24003813","https://www.scopus.com/inward/citedby.uri?partnerID=HzOxMe3b&scp=85212402702&origin=inward",29,"2026-01-04 12:44:07","Article","10.1016/j.aquatox.2024.107212","0166-445X","https://api.elsevier.com/content/abstract/scopus_id/85212402702",279,,,,1,1.00,1,1,1,"","",""
0,"M. Kučinić","Fauna, distribution, and DNA barcoding data of caddisflies (Insecta, Trichoptera) in Croatia",2025,"Zookeys","","https://www.scopus.com/inward/record.uri?partnerID=HzOxMe3b&scp=105024961298&origin=inward","https://www.scopus.com/inward/citedby.uri?partnerID=HzOxMe3b&scp=105024961298&origin=inward",85,"2026-01-04 12:44:07","Review","10.3897/zookeys.1263.152515","1313-2989","https://api.elsevier.com/content/abstract/scopus_id/105024961298",,1263,179,288,0,0.00,0,1,1,"","",""
0,"I.A. Baryshev","Features of the Structure of Macrozoobenthos of Watercourses in the Conditions of an Intact, Heavily Swamped Area: The Basin of Lake Vodlozero and the Vodla River (Vodlozersky National Park, Lake Onega Basin)",2025,"Inland Water Biology","","https://www.scopus.com/inward/record.uri?partnerID=HzOxMe3b&scp=105012902716&origin=inward","https://www.scopus.com/inward/citedby.uri?partnerID=HzOxMe3b&scp=105012902716&origin=inward",170,"2026-01-04 12:44:07","Article","10.1134/S1995082925700051","1995-0829","https://api.elsevier.com/content/abstract/scopus_id/105012902716",18,2,371,379,0,0.00,0,1,1,"","",""
0,"B. Amatya","FEEDING BIOLOGY OF THE GLYPTOSTERNINE CATFISH PARACHILOGLANIS HODGARTI (SILURIFORMES: SISORIDAE) IN NEPAL",2025,"Journal of the Bombay Natural History Society","","https://www.scopus.com/inward/record.uri?partnerID=HzOxMe3b&scp=105016007041&origin=inward","https://www.scopus.com/inward/citedby.uri?partnerID=HzOxMe3b&scp=105016007041&origin=inward",117,"2026-01-04 12:44:07","Article","10.17087/jbnhs/2025/v122/171093","0006-6982","https://api.elsevier.com/content/abstract/scopus_id/105016007041",122,2,98,104,0,0.00,0,1,1,"","",""
1,"A. Vilarino","First phylogeny of the shredder caddisfly genus Phylloicus Müller, 1880 (Trichoptera: Calamoceratidae)",2025,"Systematics and Biodiversity","","https://www.scopus.com/inward/record.uri?partnerID=HzOxMe3b&scp=105002679030&origin=inward","https://www.scopus.com/inward/citedby.uri?partnerID=HzOxMe3b&scp=105002679030&origin=inward",34,"2026-01-04 12:44:07","Article","10.1080/14772000.2025.2476059","1477-2000","https://api.elsevier.com/content/abstract/scopus_id/105002679030",23,1,,,1,1.00,1,1,1,"","",""
18,"T.H. Macher","Fit for purpose? Evaluating benthic invertebrate DNA metabarcoding for ecological status class assessment in streams under the Water Framework Directive",2025,"Water Research","","https://api.elsevier.com/content/article/eid/1-s2.0-S0043135424018876","https://www.scopus.com/inward/citedby.uri?partnerID=HzOxMe3b&scp=85212570560&origin=inward",1,"2026-01-04 12:44:07","Article","10.1016/j.watres.2024.122987","0043-1354","https://api.elsevier.com/content/abstract/scopus_id/85212570560",272,,,,18,18.00,18,1,1,"","",""
0,"A. Göthberg","Flight of Trichoptera (caddisflies) north of the Arctic Circle: seven years light-trapping in alpine Scandinavian birch forest",2025,"Aquatic Insects","","https://www.scopus.com/inward/record.uri?partnerID=HzOxMe3b&scp=105010217765&origin=inward","https://www.scopus.com/inward/citedby.uri?partnerID=HzOxMe3b&scp=105010217765&origin=inward",154,"2026-01-04 12:44:07","Article","10.1080/01650424.2025.2505720","0165-0424","https://api.elsevier.com/content/abstract/scopus_id/105010217765",46,3,292,311,0,0.00,0,1,1,"","",""
0,"C. Ogbeide","Flow Reduction in a Pesticide-Exposed Stream Mesocosm Affects Emerging Aquatic Insects and Alters Riparian Spider Communities",2025,"Archives of Environmental Contamination and Toxicology","","https://www.scopus.com/inward/record.uri?partnerID=HzOxMe3b&scp=105013236702&origin=inward","https://www.scopus.com/inward/citedby.uri?partnerID=HzOxMe3b&scp=105013236702&origin=inward",185,"2026-01-04 12:44:07","Article","10.1007/s00244-025-01146-5","0090-4341","https://api.elsevier.com/content/abstract/scopus_id/105013236702",89,2,125,135,0,0.00,0,1,1,"","",""
