Cites,Authors,Title,Year,Source,Publisher,ArticleURL,CitesURL,GSRank,QueryDate,Type,DOI,ISSN,CitationURL,Volume,Issue,StartPage,EndPage,ECC,CitesPerYear,CitesPerAuthor,AuthorCount,Age,Abstract,FullTextURL,RelatedURL
23,"S.A. Entrekin","Quantitative Food Webs Indicate Modest Increases in the Transfer of Allochthonous and Autochthonous C to Macroinvertebrates Following a Large Wood Addition to a Temperate Headwater Stream",2020,"Frontiers in Ecology and Evolution","","https://www.scopus.com/inward/record.uri?partnerID=HzOxMe3b&scp=85085688855&origin=inward","https://www.scopus.com/inward/citedby.uri?partnerID=HzOxMe3b&scp=85085688855&origin=inward",43,"2026-01-04 12:35:24","Article","10.3389/fevo.2020.00114","2296-701X","https://api.elsevier.com/content/abstract/scopus_id/85085688855",8,,,,23,3.83,23,1,6,"","",""
5,"J.B. Stribling","Relationship of taxonomic error to frequency of observation",2020,"Plos One","","https://www.scopus.com/inward/record.uri?partnerID=HzOxMe3b&scp=85096046117&origin=inward","https://www.scopus.com/inward/citedby.uri?partnerID=HzOxMe3b&scp=85096046117&origin=inward",148,"2026-01-04 12:35:24","Article","10.1371/journal.pone.0241933","1932-6203","https://api.elsevier.com/content/abstract/scopus_id/85096046117",15,11,,,5,0.83,5,1,6,"","",""
14,"P. Pedreros","Response of macroinvertebrate communities to thermal regime in small Mediterranean streams (southern South America): Implications of global warming",2020,"Limnologica","","https://api.elsevier.com/content/article/eid/1-s2.0-S0075951119301872","https://www.scopus.com/inward/citedby.uri?partnerID=HzOxMe3b&scp=85081036124&origin=inward",74,"2026-01-04 12:35:24","Article","10.1016/j.limno.2020.125763","0075-9511","https://api.elsevier.com/content/abstract/scopus_id/85081036124",81,,,,14,2.33,14,1,6,"","",""
50,"P.C. dos Reis Oliveira","Responses of macroinvertebrate communities to land use specific sediment food and habitat characteristics in lowland streams",2020,"Science of the Total Environment","","https://api.elsevier.com/content/article/eid/1-s2.0-S0048969719350521","https://www.scopus.com/inward/citedby.uri?partnerID=HzOxMe3b&scp=85075997850&origin=inward",12,"2026-01-04 12:35:24","Article","10.1016/j.scitotenv.2019.135060","0048-9697","https://api.elsevier.com/content/abstract/scopus_id/85075997850",703,,,,50,8.33,50,1,6,"","",""
5,"L.P. Giraldo","Restoration of riparian corridors in cattle ranching landscapes of the Colombian Andes: Early effects on the aquatic environment",2020,"Revista De La Academia Colombiana De Ciencias Exactas Fisicas Y Naturales","","https://www.scopus.com/inward/record.uri?partnerID=HzOxMe3b&scp=85088153136&origin=inward","https://www.scopus.com/inward/citedby.uri?partnerID=HzOxMe3b&scp=85088153136&origin=inward",161,"2026-01-04 12:35:24","Article","10.18257/raccefyn.1063","0370-3908","https://api.elsevier.com/content/abstract/scopus_id/85088153136",44,171,652,664,5,0.83,5,1,6,"","",""
15,"Z. Maguire","Retreat but no surrender: net-spinning caddisfly (Hydropsychidae) silk has enduring effects on stream channel hydraulics",2020,"Hydrobiologia","","https://www.scopus.com/inward/record.uri?partnerID=HzOxMe3b&scp=85081394884&origin=inward","https://www.scopus.com/inward/citedby.uri?partnerID=HzOxMe3b&scp=85081394884&origin=inward",72,"2026-01-04 12:35:24","Article","10.1007/s10750-020-04210-4","0018-8158","https://api.elsevier.com/content/abstract/scopus_id/85081394884",847,6,1539,1551,15,2.50,15,1,6,"","",""
4,"M.S. Pandher","Review of the genus kisaura ross 1956 (Trichoptera: Philopotamidae) from India",2020,"Zootaxa","","https://www.scopus.com/inward/record.uri?partnerID=HzOxMe3b&scp=85093477403&origin=inward","https://www.scopus.com/inward/citedby.uri?partnerID=HzOxMe3b&scp=85093477403&origin=inward",176,"2026-01-04 12:35:24","Review","10.11646/zootaxa.4845.2.9","1175-5326","https://api.elsevier.com/content/abstract/scopus_id/85093477403",4845,2,225,238,4,0.67,4,1,6,"","",""
19,"A. Martínez","Salinisation effects on leaf litter decomposition in fresh waters: Does the ionic composition of salt matter?",2020,"Freshwater Biology","","https://www.scopus.com/inward/record.uri?partnerID=HzOxMe3b&scp=85084049640&origin=inward","https://www.scopus.com/inward/citedby.uri?partnerID=HzOxMe3b&scp=85084049640&origin=inward",50,"2026-01-04 12:35:24","Article","10.1111/fwb.13514","0046-5070","https://api.elsevier.com/content/abstract/scopus_id/85084049640",65,8,1475,1483,19,3.17,19,1,6,"","",""
3,"S.M. Carlson","Scavenging of Animal Carcasses by Gumaga nigricula (Sericostomatidae, Trichoptera), an Apparent Herbivore",2020,"Western North American Naturalist","","https://www.scopus.com/inward/record.uri?partnerID=HzOxMe3b&scp=85101150109&origin=inward","https://www.scopus.com/inward/citedby.uri?partnerID=HzOxMe3b&scp=85101150109&origin=inward",195,"2026-01-04 12:35:24","Article","10.3398/064.080.0415","1527-0904","https://api.elsevier.com/content/abstract/scopus_id/85101150109",80,4,551,555,3,0.50,3,1,6,"","",""
47,"O.N. Odume","Searching for urban pollution signature and sensitive macroinvertebrate traits and ecological preferences in a river in the Eastern Cape of South Africa",2020,"Ecological Indicators","","https://api.elsevier.com/content/article/eid/1-s2.0-S1470160X19307538","https://www.scopus.com/inward/citedby.uri?partnerID=HzOxMe3b&scp=85072555240&origin=inward",14,"2026-01-04 12:35:24","Article","10.1016/j.ecolind.2019.105759","1470-160X","https://api.elsevier.com/content/abstract/scopus_id/85072555240",108,,,,47,7.83,47,1,6,"","",""
22,"S.A. Morley","Shifting food web structure during dam removal—Disturbance and recovery during a major restoration action",2020,"Plos One","","https://www.scopus.com/inward/record.uri?partnerID=HzOxMe3b&scp=85092214936&origin=inward","https://www.scopus.com/inward/citedby.uri?partnerID=HzOxMe3b&scp=85092214936&origin=inward",44,"2026-01-04 12:35:24","Article","10.1371/journal.pone.0239198","1932-6203","https://api.elsevier.com/content/abstract/scopus_id/85092214936",15,9,,,22,3.67,22,1,6,"","",""
6,"K.M. Murray-Stoker","Shifts in the community composition of caddisflies (Insecta: Trichoptera) in a subtropical river over three decades",2020,"Ecological Entomology","","https://www.scopus.com/inward/record.uri?partnerID=HzOxMe3b&scp=85075416251&origin=inward","https://www.scopus.com/inward/citedby.uri?partnerID=HzOxMe3b&scp=85075416251&origin=inward",134,"2026-01-04 12:35:24","Article","10.1111/een.12822","0307-6946","https://api.elsevier.com/content/abstract/scopus_id/85075416251",45,3,514,524,6,1.00,6,1,6,"","",""
27,"P. Cadmus","Size-Dependent Sensitivity of Aquatic Insects to Metals",2020,"Environmental Science and Technology","","https://www.scopus.com/inward/record.uri?partnerID=HzOxMe3b&scp=85078374800&origin=inward","https://www.scopus.com/inward/citedby.uri?partnerID=HzOxMe3b&scp=85078374800&origin=inward",34,"2026-01-04 12:35:24","Article","10.1021/acs.est.9b04089","0013-936X","https://api.elsevier.com/content/abstract/scopus_id/85078374800",54,2,955,964,27,4.50,27,1,6,"","",""
32,"M.A.E. Forio","Small patches of riparian woody vegetation enhance biodiversity of invertebrates",2020,"Water Switzerland","","https://www.scopus.com/inward/record.uri?partnerID=HzOxMe3b&scp=85095973563&origin=inward","https://www.scopus.com/inward/citedby.uri?partnerID=HzOxMe3b&scp=85095973563&origin=inward",24,"2026-01-04 12:35:24","Article","10.3390/w12113070","2073-4441","https://api.elsevier.com/content/abstract/scopus_id/85095973563",12,11,1,21,32,5.33,32,1,6,"","",""
9,"G.R. Desidério","Smicridea (Smicridea) nigripennis species group (Trichoptera: Hydropsychidae) from Brazil: new species, new distributional records and an identification key",2020,"Austral Entomology","","https://www.scopus.com/inward/record.uri?partnerID=HzOxMe3b&scp=85085379141&origin=inward","https://www.scopus.com/inward/citedby.uri?partnerID=HzOxMe3b&scp=85085379141&origin=inward",110,"2026-01-04 12:35:24","Article","10.1111/aen.12459","2052-174X","https://api.elsevier.com/content/abstract/scopus_id/85085379141",59,2,265,279,9,1.50,9,1,6,"","",""
10,"R. Fornaroli","Spatial and temporal patterns of macroinvertebrate assemblages in the River Po Catchment (Northern Italy)",2020,"Water Switzerland","","https://www.scopus.com/inward/record.uri?partnerID=HzOxMe3b&scp=85090887151&origin=inward","https://www.scopus.com/inward/citedby.uri?partnerID=HzOxMe3b&scp=85090887151&origin=inward",104,"2026-01-04 12:35:24","Article","10.3390/w12092452","2073-4441","https://api.elsevier.com/content/abstract/scopus_id/85090887151",12,9,,,10,1.67,10,1,6,"","",""
19,"P. Timoner","Spatial patterns of mayfly, stonefly and caddisfly assemblages in Swiss running waters in the face of global warming",2020,"Ecography","","https://www.scopus.com/inward/record.uri?partnerID=HzOxMe3b&scp=85082335634&origin=inward","https://www.scopus.com/inward/citedby.uri?partnerID=HzOxMe3b&scp=85082335634&origin=inward",52,"2026-01-04 12:35:24","Article","10.1111/ecog.04808","0906-7590","https://api.elsevier.com/content/abstract/scopus_id/85082335634",43,7,1065,1078,19,3.17,19,1,6,"","",""
4,"A.N. Metcalfe","Spatial population structure of a widespread aquatic insect in the colorado river basin: Evidence for a hydropsyche oslari species complex",2020,"Freshwater Science","","https://www.scopus.com/inward/record.uri?partnerID=HzOxMe3b&scp=85091160967&origin=inward","https://www.scopus.com/inward/citedby.uri?partnerID=HzOxMe3b&scp=85091160967&origin=inward",175,"2026-01-04 12:35:24","Article","10.1086/709022","2161-9549","https://api.elsevier.com/content/abstract/scopus_id/85091160967",39,2,309,320,4,0.67,4,1,6,"","",""
10,"J. Sultana","Species-specific macroinvertebrate responses to climate and land use scenarios in a Mediterranean catchment revealed by an integrated modelling approach",2020,"Ecological Indicators","","https://api.elsevier.com/content/article/eid/1-s2.0-S1470160X20307044","https://www.scopus.com/inward/citedby.uri?partnerID=HzOxMe3b&scp=85089244491&origin=inward",106,"2026-01-04 12:35:24","Article","10.1016/j.ecolind.2020.106766","1470-160X","https://api.elsevier.com/content/abstract/scopus_id/85089244491",118,,,,10,1.67,10,1,6,"","",""
12,"M. Kučinić","Springs: DNA barcoding of caddisflies (insecta, trichoptera) in croatia with notes on taxonomy and conservation biology",2020,"Natura Croatica","","https://www.scopus.com/inward/record.uri?partnerID=HzOxMe3b&scp=85095573187&origin=inward","https://www.scopus.com/inward/citedby.uri?partnerID=HzOxMe3b&scp=85095573187&origin=inward",82,"2026-01-04 12:35:24","Article","10.20302/NC.2020.29.8","1330-0520","https://api.elsevier.com/content/abstract/scopus_id/85095573187",29,1,73,98,12,2.00,12,1,6,"","",""
4,"L. Thorat","Structural and physical analysis of underwater silk from housing nest composites of a tropical chironomid midge",2020,"International Journal of Biological Macromolecules","","https://api.elsevier.com/content/article/eid/1-s2.0-S0141813020338204","https://www.scopus.com/inward/citedby.uri?partnerID=HzOxMe3b&scp=85087967774&origin=inward",168,"2026-01-04 12:35:24","Article","10.1016/j.ijbiomac.2020.07.070","0141-8130","https://api.elsevier.com/content/abstract/scopus_id/85087967774",163,,934,942,4,0.67,4,1,6,"","",""
7,"Y.N. Lü","Studies about Heishui River as an alternative habitat for aquatic biodiversity protection basedon macroinvertebrate community similarity",2020,"Zhongguo Huanjing Kexue China Environmental Science","","https://www.scopus.com/inward/record.uri?partnerID=HzOxMe3b&scp=85087833433&origin=inward","https://www.scopus.com/inward/citedby.uri?partnerID=HzOxMe3b&scp=85087833433&origin=inward",128,"2026-01-04 12:35:24","Article","","1000-6923","https://api.elsevier.com/content/abstract/scopus_id/85087833433",40,6,2647,2657,7,1.17,7,1,6,"","",""
10,"C.A.D. Rojas","Study of the taxonomic and functional diversity of the macroinvertebrate assemblages in an andean mountain river.",2020,"Revista De Biologia Tropical","","https://www.scopus.com/inward/record.uri?partnerID=HzOxMe3b&scp=85093837573&origin=inward","https://www.scopus.com/inward/citedby.uri?partnerID=HzOxMe3b&scp=85093837573&origin=inward",98,"2026-01-04 12:35:24","Article","10.15517/rbt.v68is2.44345","0034-7744","https://api.elsevier.com/content/abstract/scopus_id/85093837573",68,,,,10,1.67,10,1,6,"","",""
5,"A. Vilarino","Systematic revision of the caddisfly genus Machairocentron Schmid (Trichoptera: Psychomyioidea: Xiphocentronidae)",2020,"Insect Systematics and Evolution","","https://www.scopus.com/inward/record.uri?partnerID=HzOxMe3b&scp=85092554139&origin=inward","https://www.scopus.com/inward/citedby.uri?partnerID=HzOxMe3b&scp=85092554139&origin=inward",154,"2026-01-04 12:35:24","Review","10.1163/1876312X-bja10013","1399-560X","https://api.elsevier.com/content/abstract/scopus_id/85092554139",52,4,375,411,5,0.83,5,1,6,"","",""
36,"A.P.M. Santos","Taxonomic catalog of the brazilian fauna: Order trichoptera (insecta), diversity and distribution",2020,"Zoologia","","https://www.scopus.com/inward/record.uri?partnerID=HzOxMe3b&scp=85097396558&origin=inward","https://www.scopus.com/inward/citedby.uri?partnerID=HzOxMe3b&scp=85097396558&origin=inward",20,"2026-01-04 12:35:24","Article","10.3897/zoologia.37.e46392","1984-4670","https://api.elsevier.com/content/abstract/scopus_id/85097396558",37,,1,13,36,6.00,36,1,6,"","",""
13,"J. Lancaster","Terrestrial–aquatic transitions: Local abundances and movements of mature female caddisflies are related to oviposition habits but not flight capability",2020,"Freshwater Biology","","https://www.scopus.com/inward/record.uri?partnerID=HzOxMe3b&scp=85077839068&origin=inward","https://www.scopus.com/inward/citedby.uri?partnerID=HzOxMe3b&scp=85077839068&origin=inward",80,"2026-01-04 12:35:24","Article","10.1111/fwb.13472","0046-5070","https://api.elsevier.com/content/abstract/scopus_id/85077839068",65,5,908,919,13,2.17,13,1,6,"","",""
12,"K.M. Takeshita","The effect of intervention in nickel concentrations on benthic macroinvertebrates: A case study of statistical causal inference in ecotoxicology",2020,"Environmental Pollution","","https://api.elsevier.com/content/article/eid/1-s2.0-S0269749119376808","https://www.scopus.com/inward/citedby.uri?partnerID=HzOxMe3b&scp=85086931351&origin=inward",85,"2026-01-04 12:35:24","Article","10.1016/j.envpol.2020.115059","0269-7491","https://api.elsevier.com/content/abstract/scopus_id/85086931351",265,,,,12,2.00,12,1,6,"","",""
32,"J. Lidman","The effect of lead (Pb) and zinc (Zn) contamination on aquatic insect community composition and metamorphosis",2020,"Science of the Total Environment","","https://api.elsevier.com/content/article/eid/1-s2.0-S0048969720329235","https://www.scopus.com/inward/citedby.uri?partnerID=HzOxMe3b&scp=85084959801&origin=inward",25,"2026-01-04 12:35:24","Article","10.1016/j.scitotenv.2020.139406","0048-9697","https://api.elsevier.com/content/abstract/scopus_id/85084959801",734,,,,32,5.33,32,1,6,"","",""
4,"K. Holcová","THE FIRST EVIDENCE of BIOEROSION in CHITINOUS LACUSTRINE MICROFOSSILS from GLACIAL LAKES (LATE PLEISTOCENE and HOLOCENE, BOHEMIAN FOREST)",2020,"Palaios","","https://www.scopus.com/inward/record.uri?partnerID=HzOxMe3b&scp=85090462739&origin=inward","https://www.scopus.com/inward/citedby.uri?partnerID=HzOxMe3b&scp=85090462739&origin=inward",180,"2026-01-04 12:35:24","Article","10.2110/palo.2020.008","0883-1351","https://api.elsevier.com/content/abstract/scopus_id/85090462739",35,8,317,326,4,0.67,4,1,6,"","",""
16,"J. Hinić","The first record of the balkan endemic caddisfly drusus osogovicus kumanski, 1980 (Trichoptera: Limnephilidae) in the Republic of North Macedonia, with DNA barcoding of the species and comments on its ecology and distribution",2020,"Acta Zoologica Bulgarica","","https://www.scopus.com/inward/record.uri?partnerID=HzOxMe3b&scp=85095583184&origin=inward","https://www.scopus.com/inward/citedby.uri?partnerID=HzOxMe3b&scp=85095583184&origin=inward",62,"2026-01-04 12:35:24","Article","","0324-0770","https://api.elsevier.com/content/abstract/scopus_id/85095583184",72,3,369,379,16,2.67,16,1,6,"","",""
5,"B.M.S. Cavalcante","The immature stages of Phylloicus obliquus Navás, 1931 (Insecta: Trichoptera: Calamoceratidae)",2020,"Zootaxa","","https://www.scopus.com/inward/record.uri?partnerID=HzOxMe3b&scp=85081219509&origin=inward","https://www.scopus.com/inward/citedby.uri?partnerID=HzOxMe3b&scp=85081219509&origin=inward",163,"2026-01-04 12:35:24","Article","10.11646/zootaxa.4748.2.8","1175-5326","https://api.elsevier.com/content/abstract/scopus_id/85081219509",4748,2,365,374,5,0.83,5,1,6,"","",""
11,"M. Schäffer","The key role of increased fine sediment loading in shaping macroinvertebrate communities along a multiple stressor gradient in a Eurasian steppe river (Kharaa River, Mongolia)",2020,"International Review of Hydrobiology","","https://www.scopus.com/inward/record.uri?partnerID=HzOxMe3b&scp=85076738945&origin=inward","https://www.scopus.com/inward/citedby.uri?partnerID=HzOxMe3b&scp=85076738945&origin=inward",87,"2026-01-04 12:35:24","Article","10.1002/iroh.201902007","1434-2944","https://api.elsevier.com/content/abstract/scopus_id/85076738945",105,1,5,19,11,1.83,11,1,6,"","",""
54,"D.S. Kopylov","The Khasurty Fossil Insect Lagerstätte",2020,"Paleontological Journal","","https://www.scopus.com/inward/record.uri?partnerID=HzOxMe3b&scp=85100769267&origin=inward","https://www.scopus.com/inward/citedby.uri?partnerID=HzOxMe3b&scp=85100769267&origin=inward",11,"2026-01-04 12:35:24","Article","10.1134/S0031030120110027","0031-0301","https://api.elsevier.com/content/abstract/scopus_id/85100769267",54,11,1221,1394,54,9.00,54,1,6,"","",""
8,"S. Vitecek","The larva of drusus dudor oláh, 2017, including an updated key to larval drusinae banks, 1916 (Insecta, trichoptera, limnephilidae)",2020,"Zookeys","","https://www.scopus.com/inward/record.uri?partnerID=HzOxMe3b&scp=85079120660&origin=inward","https://www.scopus.com/inward/citedby.uri?partnerID=HzOxMe3b&scp=85079120660&origin=inward",119,"2026-01-04 12:35:24","Article","10.3897/zookeys.908.47032","1313-2989","https://api.elsevier.com/content/abstract/scopus_id/85079120660",2020,908,137,155,8,1.33,8,1,6,"","",""
4,"H. Vicentini","The larva of hydropsyche doehleri tobias 1972, based on swiss material (Hydropsychidae, Trichoptera)#",2020,"Zootaxa","","https://www.scopus.com/inward/record.uri?partnerID=HzOxMe3b&scp=85086087157&origin=inward","https://www.scopus.com/inward/citedby.uri?partnerID=HzOxMe3b&scp=85086087157&origin=inward",169,"2026-01-04 12:35:24","Review","10.11646/zootaxa.4786.4.5","1175-5326","https://api.elsevier.com/content/abstract/scopus_id/85086087157",4786,4,535,545,4,0.67,4,1,6,"","",""
3,"S. Qiu","The psilotreta banks, 1899 of the dabie mountains, east central china, with descriptions of two new species (Insecta: Trichoptera: Odontoceridae)",2020,"European Journal of Taxonomy","","https://www.scopus.com/inward/record.uri?partnerID=HzOxMe3b&scp=85079445050&origin=inward","https://www.scopus.com/inward/citedby.uri?partnerID=HzOxMe3b&scp=85079445050&origin=inward",187,"2026-01-04 12:35:24","Article","10.5852/ejt.2020.601","2118-9773","https://api.elsevier.com/content/abstract/scopus_id/85079445050",2020,601,,,3,0.50,3,1,6,"","",""
18,"M. Valladolid","The Rhyacophila fasciata Group in Croatia and Bosnia and Herzegovina: Rhyacophila f. fasciata Hagen 1859 and the description of two new subspecies, Rhyacophila fasciata delici Kučinić & Valladolid (ssp. nov.) from Croatia and Bosnia and Herzegovina and Rhyacophila fasciata viteceki Valladolid & Kučinić (ssp. nov.) from Bosnia and Herzegovina (Trichoptera: Rhyacophilidae)",2020,"Zootaxa","","https://www.scopus.com/inward/record.uri?partnerID=HzOxMe3b&scp=85096794463&origin=inward","https://www.scopus.com/inward/citedby.uri?partnerID=HzOxMe3b&scp=85096794463&origin=inward",56,"2026-01-04 12:35:24","Review","10.11646/zootaxa.4885.1.3","1175-5326","https://api.elsevier.com/content/abstract/scopus_id/85096794463",4885,1,51,75,18,3.00,18,1,6,"","",""
8,"D.d.A. Barbosa","The role of spatial and environmental variables in shaping aquatic insect assemblages in two protected areas in the transition area between cerrado and amazônia",2020,"Biota Neotropica","","https://www.scopus.com/inward/record.uri?partnerID=HzOxMe3b&scp=85090743981&origin=inward","https://www.scopus.com/inward/citedby.uri?partnerID=HzOxMe3b&scp=85090743981&origin=inward",120,"2026-01-04 12:35:24","Article","10.1590/1676-0611-bn-2019-0923","1676-0603","https://api.elsevier.com/content/abstract/scopus_id/85090743981",20,3,1,9,8,1.33,8,1,6,"","",""
63,"A.B. Ruchin","The use of simple crown traps for the insects collection",2020,"Nature Conservation Research","","https://www.scopus.com/inward/record.uri?partnerID=HzOxMe3b&scp=85078278267&origin=inward","https://www.scopus.com/inward/citedby.uri?partnerID=HzOxMe3b&scp=85078278267&origin=inward",8,"2026-01-04 12:35:24","Article","10.24189/ncr.2020.008","2500-008X","https://api.elsevier.com/content/abstract/scopus_id/85078278267",5,1,87,108,63,10.50,63,1,6,"","",""
25,"L.S. Balistrieri","Time-dependent accumulation of Cd, Co, Cu, Ni, and Zn in natural communities of mayfly and caddisfly larvae: Metal sensitivity, uptake pathways, and mixture toxicity",2020,"Science of the Total Environment","","https://api.elsevier.com/content/article/eid/1-s2.0-S0048969720325286","https://www.scopus.com/inward/citedby.uri?partnerID=HzOxMe3b&scp=85085257773&origin=inward",40,"2026-01-04 12:35:24","Article","10.1016/j.scitotenv.2020.139011","0048-9697","https://api.elsevier.com/content/abstract/scopus_id/85085257773",732,,,,25,4.17,25,1,6,"","",""
5,"L. Tronstad","To composite or replicate: how sampling method and protocol differences alter collected stream invertebrates and associated bioassessment metrics",2020,"Environmental Monitoring and Assessment","","https://www.scopus.com/inward/record.uri?partnerID=HzOxMe3b&scp=85088167560&origin=inward","https://www.scopus.com/inward/citedby.uri?partnerID=HzOxMe3b&scp=85088167560&origin=inward",150,"2026-01-04 12:35:24","Article","10.1007/s10661-020-08489-7","0167-6369","https://api.elsevier.com/content/abstract/scopus_id/85088167560",192,8,,,5,0.83,5,1,6,"","",""
59,"L. Gallitelli","Transport and deposition of microplastics and mesoplastics along the river course: A case study of a small river in central Italy",2020,"Hydrology","","https://www.scopus.com/inward/record.uri?partnerID=HzOxMe3b&scp=85097401381&origin=inward","https://www.scopus.com/inward/citedby.uri?partnerID=HzOxMe3b&scp=85097401381&origin=inward",9,"2026-01-04 12:35:24","Article","10.3390/hydrology7040090","2306-5338","https://api.elsevier.com/content/abstract/scopus_id/85097401381",7,4,1,16,59,9.83,59,1,6,"","",""
6,"B. Samraoui","Trichoptera and Plecoptera of the Seybouse River, northeast Algeria: Distribution, phenology and new records",2020,"Zootaxa","","https://www.scopus.com/inward/record.uri?partnerID=HzOxMe3b&scp=85091381852&origin=inward","https://www.scopus.com/inward/citedby.uri?partnerID=HzOxMe3b&scp=85091381852&origin=inward",135,"2026-01-04 12:35:24","Article","10.11646/zootaxa.4845.4.5","1175-5326","https://api.elsevier.com/content/abstract/scopus_id/85091381852",4845,4,552,564,6,1.00,6,1,6,"","",""
7,"J.D. Oliveros-Villanueva","Trichoptera larvae in an altitudinal gradient in a Neotropical river",2020,"Revista De La Academia Colombiana De Ciencias Exactas Fisicas Y Naturales","","https://www.scopus.com/inward/record.uri?partnerID=HzOxMe3b&scp=85088146549&origin=inward","https://www.scopus.com/inward/citedby.uri?partnerID=HzOxMe3b&scp=85088146549&origin=inward",127,"2026-01-04 12:35:24","Article","10.18257/raccefyn.1148","0370-3908","https://api.elsevier.com/content/abstract/scopus_id/85088146549",44,171,493,506,7,1.17,7,1,6,"","",""
8,"M.D. Munn","Understanding the relationship between stream metabolism and biological assemblages",2020,"Freshwater Science","","https://www.scopus.com/inward/record.uri?partnerID=HzOxMe3b&scp=85092602963&origin=inward","https://www.scopus.com/inward/citedby.uri?partnerID=HzOxMe3b&scp=85092602963&origin=inward",124,"2026-01-04 12:35:24","Article","10.1086/711690","2161-9549","https://api.elsevier.com/content/abstract/scopus_id/85092602963",39,4,680,692,8,1.33,8,1,6,"","",""
20,"D.M.P. Castro","Unveiling patterns of taxonomic and functional diversities of stream insects across four spatial scales in the neotropical savanna",2020,"Ecological Indicators","","https://api.elsevier.com/content/article/eid/1-s2.0-S1470160X2030707X","https://www.scopus.com/inward/citedby.uri?partnerID=HzOxMe3b&scp=85088962894&origin=inward",48,"2026-01-04 12:35:24","Article","10.1016/j.ecolind.2020.106769","1470-160X","https://api.elsevier.com/content/abstract/scopus_id/85088962894",118,,,,20,3.33,20,1,6,"","",""
10,"L.A.S. Moreno","Updated checklist of caddisflies (Insecta: Trichoptera) from the state of Piauí, Northeast Brazil, including a new species and new geographical records",2020,"Zootaxa","","https://www.scopus.com/inward/record.uri?partnerID=HzOxMe3b&scp=85091419736&origin=inward","https://www.scopus.com/inward/citedby.uri?partnerID=HzOxMe3b&scp=85091419736&origin=inward",107,"2026-01-04 12:35:24","Article","10.11646/zootaxa.4838.2.6","1175-5326","https://api.elsevier.com/content/abstract/scopus_id/85091419736",4838,2,257,272,10,1.67,10,1,6,"","",""
25,"M.J.M. Ganassin","Urbanisation affects the diet and feeding selectivity of the invasive guppy Poecilia reticulata",2020,"Ecology of Freshwater Fish","","https://www.scopus.com/inward/record.uri?partnerID=HzOxMe3b&scp=85074769433&origin=inward","https://www.scopus.com/inward/citedby.uri?partnerID=HzOxMe3b&scp=85074769433&origin=inward",39,"2026-01-04 12:35:24","Article","10.1111/eff.12511","0906-6691","https://api.elsevier.com/content/abstract/scopus_id/85074769433",29,2,252,265,25,4.17,25,1,6,"","",""
